sentence	start	end	text_name	words	chars
Ja kurkisteli navetalle.	388358	388382	lehtonen1910a	2	24
Ja Kuula on juovuksissa.	92086	92110	jarnefelt1913a	3	24
Ja kuuleepa Käkriäinen sitten muutakin.	404985	405024	lehtonen1910a	4	39
Ja kuulkaa.	42116	42127	pakkala1895a	1	11
Ja kuuluivat keskenään nauravankin.	339421	339456	lehtonen1910a	3	35
Ja kuvastuvat veteen kuin mitkäkin untuvat.	390257	390300	lehtonen1910a	5	43
Ja kyllä minä aina sanasen keksin.	795341	795375	lehtonen1910a	5	34
Ja kyllä silloin pistää suunsa metiseksi.	300491	300532	lehtonen1910a	5	41
Ja kyllä täällä rahaa tarvitaan.	42125	42157	lehtonen1910a	4	32
Ja lampaita on.	65837	65852	lehtonen1910a	2	15
Ja langon puolelta, ystävän muka.	501345	501378	lehtonen1910a	4	33
Ja lapsiaan hän siinä huutelee.	200548	200579	lehtonen1910a	4	31
Ja lapsistahan se pitääkin.	57156	57183	lehtonen1910a	3	27
Ja lataa uutta.	381459	381474	lehtonen1910a	2	15
Ja lauhkea niinkuin mesi.	659398	659423	lehtonen1910a	3	25
Ja laulaa, laulaa.	68537	68555	lehtonen1910a	2	18
Ja leipä on Putkinotkossa lopussa.	380479	380513	lehtonen1910a	4	34
Ja Leistén on ollut oikein vihainen.	191215	191251	canth1886a	5	36
Ja Lejakin rauhoittaa vanhinta veljeään.	726011	726051	lehtonen1910a	4	40
Ja Lejalla sekä Jopilla.	315663	315687	lehtonen1910a	3	24
Ja liikkumattomuus, ja äänettömyys.	116488	116523	canth1886a	3	35
Ja Liisa oli kaikista alakuloisin.	69481	69515	pakkala1895a	4	34
Ja loppuvat eväät pennuilta.	95834	95862	lehtonen1910a	3	28
Ja lotjatöillä se on velkansa maksanut.	366226	366265	lehtonen1910a	5	39
Ja louhiselle mäelle.	500734	500755	lehtonen1910a	2	21
Ja luita kolottaa, ja päähän pistelee.	687401	687439	lehtonen1910a	5	38
Ja Luukas, mitä se pikkuinen itkee?	520594	520629	lehtonen1910a	5	35
Ja lystiä koetettiin pitää minulle.	449908	449943	lehtonen1910a	4	35
Ja maha pullottaa, oikea herran maha.	548368	548405	lehtonen1910a	5	37
Ja makea on sillekin, hyväkkäälle.	548748	548782	lehtonen1910a	4	34
Ja makeaa se on, tuulaskala.	691600	691628	lehtonen1910a	4	28
Ja Malakiaksella oli.	566621	566642	lehtonen1910a	2	21
Ja Malakias joutaa löylynlyöjäksi.	695234	695268	lehtonen1910a	3	34
Ja Malakias rupesi juoksemaan linnun perästä.	172949	172994	lehtonen1910a	5	45
Ja Malakias?	511842	511854	lehtonen1910a	1	12
Ja Martti oli heidät pelastanut.	84562	84594	jarnefelt1916a	4	32
Ja Martti, mitä hän teki?	253440	253465	jarnefelt1916a	4	25
Ja Mauno joutuu uudestaan rautoihin.	506697	506733	lehtonen1910a	4	36
Ja Mauno puhuukin hiljemmin.	490869	490897	lehtonen1910a	3	28
Ja Maunon Perttakin röijyä päälleen pujotellen.	743657	743704	lehtonen1910a	5	47
Ja Maunon piti lähteä.	293705	293727	lehtonen1910a	3	22
Ja meillä on niin vaikeata.	161760	161787	canth1886a	4	27
Ja menee ylös kalliolle ja petäjikköön.	125738	125777	lehtonen1910a	5	39
Ja meneepä puolikin tuntia.	203849	203876	lehtonen1910a	3	27
Ja meneepä siitä ylitse.	500888	500912	lehtonen1910a	3	24
Ja mihinkäs se Malakias on mennyt?	76122	76156	lehtonen1910a	5	34
Ja mikäs tämä haju sitten olikaan?	583238	583272	lehtonen1910a	5	34
Ja miksikä ei jo heti?	306293	306315	lehtonen1910a	4	22
Ja miksikä tekisi?	75443	75461	kilpi1903a	2	18
Ja minä huokasin kevennyksestä.	62065	62096	jarnefelt1913a	3	31
Ja minä kun tahtoisin heidän ystävyyttään.	776562	776604	lehtonen1910a	5	42
Ja minä kuulin heidän välisensä keskustelun.	103982	104026	jarnefelt1916a	5	44
Ja minä vain jauhoin ja jauhoin.	42860	42892	jarnefelt1916a	5	32
Ja minkälaista täällä oli viime talvena.	627098	627138	lehtonen1910a	5	40
Ja minun on keitettävä varikkoa.	303225	303257	lehtonen1910a	4	32
Ja missä ovat kaikki muut sanikat?	511926	511960	lehtonen1910a	5	34
Ja missä se Juutas on?	694579	694601	lehtonen1910a	4	22
Ja missäs nyt ihmiset?	385500	385522	lehtonen1910a	3	22
Ja mistä lienee tullut?	415738	415761	lehtonen1910a	3	23
Ja mitä hän tällaiseen?	745549	745572	lehtonen1910a	3	23
Ja mitä he sillä tiedolla tekisivät.	141458	141494	lehtonen1910a	5	36
Ja mitä pahaa siinä oikeastaan oli?	151279	151314	canth1886a	5	35
Ja mitä se oikeastaan minuun koskee?	91746	91782	jarnefelt1913a	5	36
Ja mitä se tavaroiden kantaminen maksaa?	596767	596807	lehtonen1910a	5	40
Ja mitä sinä hänelle aiot?	781447	781473	lehtonen1910a	4	26
Ja mitä?	427148	427156	lehtonen1910a	1	8
Ja mitähän Muttinen selityksellään tarkoittaa?	718983	719029	lehtonen1910a	4	46
Ja mitähän se Aapeli Juutaksesta?	707763	707796	lehtonen1910a	4	33
Ja mitähän se emäntäneiti mekastaa?	344129	344164	lehtonen1910a	4	35
Ja mitäpä neidin lepertelyistä: teeskentelee.	552968	553013	lehtonen1910a	4	45
Ja mitäs se herrassyötinki siihen?	621333	621367	lehtonen1910a	4	34
Ja mitäs: jo parani pöhötys jalasta.	719691	719727	lehtonen1910a	5	36
Ja mitenkä hän olisi täyttänyt?	28824	28855	lehtonen1910a	4	31
Ja mitenkäs hän?	751674	751690	lehtonen1910a	2	16
Ja molemmat alkoivat viskellä kivillä.	67617	67655	pakkala1895a	4	38
Ja morotit, minä sanon, hahaa.	150811	150841	lehtonen1910a	4	30
Ja muidenkin pentujen olevan vielä kotona.	200069	200111	lehtonen1910a	5	42
Ja muut lehmät ajakaa metsään.	425260	425290	lehtonen1910a	4	30
Ja muut pojat.	694564	694578	lehtonen1910a	2	14
Ja muut.	645171	645179	lehtonen1910a	1	8
Ja muuta ei nytkään tarvittu.	130860	130889	jarnefelt1916a	4	29
Ja muuta, heh.	596511	596525	lehtonen1910a	2	14
Ja myös yhtä notkea ja siro.	92191	92219	jarnefelt1916a	5	28
Ja naivansa on hän vannoskellut Sanelman.	793879	793920	lehtonen1910a	5	41
Ja näkeehän mies ajan viisarit auringostakin.	409177	409222	lehtonen1910a	5	45
Ja näkyy tuosta jyvääkin tulevan.	476187	476220	lehtonen1910a	4	33
Ja nälkä uhkaa.	53735	53750	lehtonen1910a	2	15
Ja narrasi sitä miestään, nuorena vaimona.	322272	322314	lehtonen1910a	5	42
Ja nätti se onkin.	290013	290031	lehtonen1910a	3	18
Ja nauraa kirkkain äänin.	68480	68505	lehtonen1910a	3	25
Ja nauroi.	360815	360825	lehtonen1910a	1	10
Ja ne alkamattomat puuskat ovat pitkiä.	47528	47567	lehtonen1910a	5	39
Ja ne ovat kauniita kuin paperikukat.	283144	283181	lehtonen1910a	5	37
Ja ne tekevät sinne omia laitoksiaan.	504268	504305	lehtonen1910a	5	37
Ja neuvomaan niitä töihin, isompia niistä.	200940	200982	lehtonen1910a	5	42
Ja niiden takana kiiluu saarinen ulappa.	611862	611902	lehtonen1910a	5	40
Ja niillä on siellä sianporsas mukana.	201813	201851	lehtonen1910a	5	38
Ja niin erinomaisen lämmin nyt on.	116674	116708	canth1886a	5	34
Ja niin he menivät uudestaan kaupungille.	25902	25943	pakkala1895a	5	41
Ja niin kaunis peitekin.	107322	107346	pakkala1895a	3	24
Ja niin kävi joka talossa.	50801	50827	pakkala1895a	4	26
Ja niin koko maailmaa.	784481	784503	lehtonen1910a	3	22
Ja niin märkänevät mahassakin.	150143	150173	lehtonen1910a	3	30
Ja niin olikin.	35897	35912	jarnefelt1916a	2	15
Ja niin olikin.	145380	145395	jarnefelt1916a	2	15
Ja niin sanoin sille herrallekin, insinöörille.	301500	301547	lehtonen1910a	5	47
Ja niinhän sillä olikin.	309631	309655	lehtonen1910a	3	24
Ja noin ruskea.	542284	542299	lehtonen1910a	2	15
Ja nukkui taas pitkään.	125522	125545	pakkala1895a	3	23
Ja nuo saaret siellä ikäänkuin uivat.	390185	390222	lehtonen1910a	5	37
Ja nyt alkaa Putkinotkossa komento.	422415	422450	lehtonen1910a	4	35
Ja nyt hänen sydämensä hätkähtää.	154276	154309	lehtonen1910a	4	33
Ja nyt he antavat Putkinotkon rappeutua.	779980	780020	lehtonen1910a	5	40
Ja nyt on kiirein heinäaika.	285774	285802	lehtonen1910a	4	28
Ja nyt se tulee Juutaksen perästäkin.	499260	499297	lehtonen1910a	5	37
Ja nyt seurasi pitkä yö.	100026	100050	lassila1910a	4	24
Ja nytkös tuli kiire.	273108	273129	jarnefelt1916a	3	21
Ja oikea silmä katseli humaliston juurelle.	168274	168317	lehtonen1910a	5	43
Ja oikein kauniita marjoja.	86559	86586	pakkala1895a	3	27
Ja oikeutettuakin Jumalan rangaistusta se olisi.	279351	279399	lehtonen1910a	5	48
Ja oksien rapinaa saunan päätyseinään.	663595	663633	lehtonen1910a	4	38
Ja olen neuvonut.	779116	779133	lehtonen1910a	2	17
Ja oli paljon lupaillut.	57008	57032	lehtonen1910a	3	24
Ja oli toivonut, että he vaurastuisivat.	661721	661761	lehtonen1910a	5	40
Ja olipa itse pompommiherrakin.	737852	737883	lehtonen1910a	3	31
Ja olisi annettu miten paljon tahansa.	448063	448101	lehtonen1910a	5	38
Ja on isäkin alkanut vihjailla.	230216	230247	lehtonen1910a	4	31
Ja on muutakin.	195895	195910	lehtonen1910a	2	15
Ja on niitä ollut käärmeitä minussakin.	713120	713159	lehtonen1910a	5	39
Ja onhan kielletty homma jokaisesta makeaa.	662973	663016	lehtonen1910a	5	43
Ja onhan kuoppa täynnä perunoita.	48190	48223	lehtonen1910a	4	33
Ja onhan niitä täällä taloissakin.	770714	770748	lehtonen1910a	4	34
Ja onhan se totta.	466906	466924	lehtonen1910a	3	18
Ja onkia, sormenpituisia ahvenia, hihii.	246964	247004	lehtonen1910a	4	40
Ja onkin asiassa monet mutkat.	482998	483028	lehtonen1910a	4	30
Ja onko Juutas tullut jo myllyltä?	424341	424375	lehtonen1910a	5	34
Ja osanneeko tuo haastella, kala?	691473	691506	lehtonen1910a	4	33
Ja ovessa tullessaan hän pyyhki otsaansa.	139828	139869	canth1886a	5	41
Ja pahemminkin: heidän mielialansa meikäläistä kohtaan.	768164	768219	lehtonen1910a	5	55
Ja paitsi sardiineita on oikein hummereita.	601320	601363	lehtonen1910a	5	43
Ja pakenee aidan luota kiireesti pois.	99667	99705	lehtonen1910a	5	38
Ja paljon toivoivat he saavansa.	91320	91352	pakkala1895a	4	32
Ja panee poliisit viinoistakin ahdistamaan.	302213	302256	lehtonen1910a	4	43
Ja pelästyy.	124928	124940	lehtonen1910a	1	12
Ja pentuja.	506191	506202	lehtonen1910a	1	11
Ja Pertta Kinnusella kanssa?	494346	494374	lehtonen1910a	3	28
Ja pesemään tullaan herraa.	693929	693956	lehtonen1910a	3	27
Ja pieksää kädellään.	507559	507580	lehtonen1910a	2	21
Ja pieni vuona mäkättää valittavasti.	689266	689303	lehtonen1910a	4	37
Ja pienistä on kasvatettu.	458082	458108	lehtonen1910a	3	26
Ja piippuaan rassaten.	73779	73801	lehtonen1910a	2	22
Ja piippukin kädessä vapisee.	101682	101711	lehtonen1910a	3	29
Ja piipun piki on hyvä hampaankolotukseen.	214260	214302	lehtonen1910a	5	42
Ja piirongit tytöille.	390536	390558	lehtonen1910a	2	22
Ja pikku Luukas on kehdossa.	326943	326971	lehtonen1910a	4	28
Ja pilkata.	273537	273548	lehtonen1910a	1	11
Ja pitäisi ostaa uusi hevonen.	65853	65883	lehtonen1910a	4	30
Ja pitäköön kemut Juutas.	787909	787934	lehtonen1910a	3	25
Ja pitelemään Poikaa kujan suussa.	678696	678730	lehtonen1910a	4	34
Ja poikain silmät hän pesi.	36689	36716	canth1886a	4	27
Ja polvet hiukan tutisevat.	376021	376048	lehtonen1910a	3	27
Ja puhalsi kynttilän sammuksiin.	134474	134506	canth1886a	3	32
Ja puhdas tuli.	275946	275961	lehtonen1910a	2	15
Ja puhkesin onneni täyteen kukoistukseen.	40171	40212	jarnefelt1913a	4	41
Ja puhuinkin siitä komesrootille.	345060	345093	lehtonen1910a	3	33
Ja pujahtaa matalasta ovesta aittaan.	104422	104459	lehtonen1910a	4	37
Ja puolella hintaa?	370005	370024	lehtonen1910a	2	19
Ja puutarhani rappiolla.	773108	773132	lehtonen1910a	2	24
Ja raapisivat itseään raivoisasti.	17745	17779	lehtonen1910a	3	34
Ja rahaa lähtikin Käkriäiselle.	94633	94664	lehtonen1910a	3	31
Ja rahtaamaan pataa kodasta.	188145	188173	lehtonen1910a	3	28
Ja rakastaapa hän kuitenkin pohjaltaan lapsiaan.	161323	161371	lehtonen1910a	5	48
Ja rauhallista, hiljaista, kodikasta.	133809	133846	canth1886a	3	37
Ja Repekka alkaa huutaa.	725414	725438	lehtonen1910a	3	24
Ja Repekkakin rupeaa väkisin tempomaan.	434747	434786	lehtonen1910a	4	39
Ja retkuväet.	150360	150373	lehtonen1910a	1	13
Ja Ripatti olisi tahtonut melkeinpä ilmaiseksi.	342993	343040	lehtonen1910a	5	47
Ja romaanilla olisi ollut arvokas alkunsa.	10200	10242	jarnefelt1916a	5	42
Ja röpöteistä sai oikein mukavaa ruokaa.	143002	143042	lehtonen1910a	5	40
Ja Rosina huokaisee.	32928	32948	lehtonen1910a	2	20
Ja rotakolla menee.	234416	234435	lehtonen1910a	2	19
Ja rouhaista oikein sylin täydeltä.	462406	462441	lehtonen1910a	4	35
Ja ruokakonttorinsa ja aittansa ja riihensä.	411985	412029	lehtonen1910a	5	44
Ja ruokalystin se antaa.	666162	666186	lehtonen1910a	3	24
Ja rupea ihan heti, viimeinkin.	308104	308135	lehtonen1910a	4	31
Ja rupesi hiljaa itkemään.	292653	292679	jarnefelt1916a	3	26
Ja rupesi nousemaan ikäänkuin lähteäkseen.	251724	251766	jarnefelt1916a	4	42
Ja rupesi nyyhkyttämään.	741483	741507	lehtonen1910a	2	24
Ja rutto kuolema.	716173	716190	lehtonen1910a	2	17
Ja ruumis jäässä.	676893	676910	lehtonen1910a	2	17
Ja ryntäsi rannemmaksi.	623585	623608	lehtonen1910a	2	23
Ja Saara yökötteleiksen.	182307	182331	lehtonen1910a	2	24
Ja saarnaamaan korpijoonin myymisestäkin.	707135	707176	lehtonen1910a	3	41
Ja sähkösytytyksellä se käy.	530525	530553	lehtonen1910a	3	28
Ja säikähti uudelleen niin, että vavahti.	61212	61253	pakkala1895a	5	41
Ja saisi sen polttimon jonnekin kätköön.	187195	187235	lehtonen1910a	5	40
Ja salasin kaikki.	66826	66844	jarnefelt1913a	2	18
Ja saliin vietiin, toppatuoliin istutettiin.	449863	449907	lehtonen1910a	4	44
Ja samalla alkavat airot soutaa.	790552	790584	lehtonen1910a	4	32
Ja samalla häntä ikään kuin kiukuttaa.	462235	462273	lehtonen1910a	5	38
Ja Sanelma lähtee Lejan kanssa.	427976	428007	lehtonen1910a	4	31
Ja Sanelma sanoo paistavansa ahveniakin.	664477	664517	lehtonen1910a	4	40
Ja sanoin näyttäväni hänelle takapompelini.	301548	301591	lehtonen1910a	4	43
Ja satakertoja.	452218	452233	lehtonen1910a	1	15
Ja se hohde muuttuu yhä keltaisemmaksi.	626565	626604	lehtonen1910a	5	39
Ja se ihmetyttää Käkriäistä.	564537	564565	lehtonen1910a	3	28
Ja se kaipuu kasvatti runkoni.	38417	38447	jarnefelt1913a	4	30
Ja se keitetään.	311041	311057	lehtonen1910a	2	16
Ja se nautitaan sisällisesti.	716266	716295	lehtonen1910a	3	29
Ja se nousi ja nousi.	283511	283532	jarnefelt1916a	4	21
Ja se oli iltahämärä, melkeinpä pimeä.	95400	95438	lehtonen1910a	5	38
Ja se olikin käärme.	714318	714338	lehtonen1910a	3	20
Ja se on jälleen puutteen lisä.	745235	745266	lehtonen1910a	5	31
Ja se on tässä ratkaisevaa.	261071	261098	jarnefelt1916a	4	27
Ja se riittikin vuosiksi.	775292	775317	lehtonen1910a	3	25
Ja se säkki, säkki.	386306	386325	lehtonen1910a	3	19
Ja se suututtaa Juutasta.	483611	483636	lehtonen1910a	3	25
Ja se tapailee jo kiekon muotoa.	577171	577203	lehtonen1910a	5	32
Ja se tuntui niin hauskalle.	39464	39492	pakkala1895a	4	28
Ja se vastauskos ärsyttää Juutasta.	92128	92163	lehtonen1910a	4	35
Ja sekaan collodiumia.	277079	277101	lehtonen1910a	2	22
Ja selitän.	150651	150662	lehtonen1910a	1	11
Ja sen auttamisen ne ihmiset muistavat.	113801	113840	lehtonen1910a	5	39
Ja sen henki löyhkää vähän väkeville.	277864	277901	lehtonen1910a	5	37
Ja sen jälkeen lähtee jono rannalle.	163624	163660	lehtonen1910a	5	36
Ja sen neidinkin perässä.	545609	545634	lehtonen1910a	3	25
Ja sen on pullea Aapeli tehnyt.	586895	586926	lehtonen1910a	5	31
Ja sentähdenkö sitä aina nukuttaneekin.	75674	75713	lehtonen1910a	4	39
Ja siellä on myöskin Topi.	512109	512135	lehtonen1910a	4	26
Ja siellä rupesin laulamaan.	301256	301284	lehtonen1910a	3	28
Ja sieraimiinkin hiki tunkeutuu.	382051	382083	lehtonen1910a	3	32
Ja siihen luottivat toisetkin.	96228	96258	pakkala1895a	3	30
Ja siihenpä koko onneni sisältyykin.	156288	156324	jarnefelt1916a	4	36
Ja siinä tahraa itsensä.	603498	603522	lehtonen1910a	3	24
Ja siitä oli jo kauan.	29780	29802	pakkala1895a	4	22
Ja sillä oli korvat päässä, punaiset.	217227	217264	lehtonen1910a	5	37
Ja silloin ei hän enää malttanut.	11012	11045	lassila1910a	5	33
Ja silloin miehen vimma yhä kiihtyy.	102428	102464	lehtonen1910a	5	36
Ja silloin tulee hänen ilmeensä iloisemmaksi.	543541	543586	lehtonen1910a	5	45
Ja silloin tulee uutta viljaakin.	487057	487090	lehtonen1910a	4	33
Ja sinä, Jopi, ota tuo nyytti.	160503	160533	lehtonen1910a	5	30
Ja sinunhan olisi katseltava raja-aitoja.	604146	604187	lehtonen1910a	4	41
Ja sitähän minä itkin.	120217	120239	canth1886a	3	22
Ja sitäpaitsi on Rosina vahva.	102757	102787	lehtonen1910a	4	30
Ja sitten ajetaan kätkyellä uunia kohti.	681334	681374	lehtonen1910a	5	40
Ja sitten Ananias unohtaa koko ampumisen.	795940	795981	lehtonen1910a	5	41
Ja sitten hän kalpeni.	79433	79455	lehtonen1910a	3	22
Ja sitten hän kellahtaa loikomaan.	700077	700111	lehtonen1910a	4	34
Ja sitten hänen kuitenkin täytyi kertoa.	119796	119836	canth1886a	5	40
Ja sitten jättäisi polttamisen.	188023	188054	lehtonen1910a	3	31
Ja sitten kaikuu karjapihasta Rosinan ääni.	457469	457512	lehtonen1910a	5	43
Ja sitten Käkriäinen pukeutui parempiinsa.	50791	50833	lehtonen1910a	4	42
Ja sitten kuuluu myöskin Jopin puhelua.	471848	471887	lehtonen1910a	5	39
Ja sitten louhien koloon mäyrien luokse.	780140	780180	lehtonen1910a	5	40
Ja sitten maannut.	94031	94049	lehtonen1910a	2	18
Ja sitten Malakias lähteekin hakemaan saunapuita.	655307	655356	lehtonen1910a	5	49
Ja sitten ne äkkiä taas kirkastuivat.	234470	234507	canth1886a	5	37
Ja sitten ne lähtevätkin naurahtelemasta.	259969	260010	lehtonen1910a	4	41
Ja sitten on hän tuokion vaiti.	147155	147186	lehtonen1910a	5	31
Ja sitten on näkynyt kaupunki.	239214	239244	lehtonen1910a	4	30
Ja sitten pienillä-pienillä hakasilla sidon itseeni.	43196	43248	jarnefelt1913a	5	52
Ja sitten Putkinotkon mökki.	505525	505553	lehtonen1910a	3	28
Ja sitten Repekka nauraa kirkkain silmin.	132038	132079	lehtonen1910a	5	41
Ja sitten se alkaa, se löylytys.	701055	701087	lehtonen1910a	5	32
Ja sitten teki mekot lapsille.	249441	249471	lehtonen1910a	4	30
Ja sitten Topi Sanelmaa.	227812	227836	lehtonen1910a	3	24
Ja sitten tuli viimekesäisestä naurusta itku.	741752	741797	lehtonen1910a	5	45
Ja sittenkös se oli alkanut juosta.	202226	202261	lehtonen1910a	5	35
Ja sivistyisivätkin.	661762	661782	lehtonen1910a	1	20
Ja Sohvi.	386296	386305	lehtonen1910a	1	9
Ja sotaväen musiikki otetaan matkaan.	179915	179952	canth1886a	4	37
Ja sukat olivat kauniit.	110341	110365	pakkala1895a	3	24
Ja suoraa kuin nuoraa, hihii.	427279	427308	lehtonen1910a	4	29
Ja suostuu antamaan toisellekin osuutensa, Maunolle.	638266	638318	lehtonen1910a	5	52
Ja syömään mukavammin.	661838	661860	lehtonen1910a	2	22
Ja syömistä muulloinkin kuin ihmisten ruoka-aikoina.	119339	119391	lehtonen1910a	5	52
Ja täällä on metsiä.	485471	485491	lehtonen1910a	3	20
Ja taas ärjyy hän Topille.	210213	210239	lehtonen1910a	4	26
Ja taas muistui mieleen kaivovesi.	289399	289433	lassila1910a	4	34
Ja tähdet välkkyvät.	6054	6074	lehtonen1910a	2	20
Ja talvella ne kaalit märkänevät kuopassa.	207851	207893	lehtonen1910a	5	42
Ja tanssia.	230353	230364	lehtonen1910a	1	11
Ja tapaako Perttaa Potamian puolella.	286041	286078	lehtonen1910a	4	37
Ja tapella, juoda miesten kanssa.	472866	472899	lehtonen1910a	4	33
Ja tappaa pentunsa ja kaikki.	503940	503969	lehtonen1910a	4	29
Ja taputtaa Esteriä poskelle.	554092	554121	lehtonen1910a	3	29
Ja tarjoaapa Maunollekin vavahtavin käsin.	555649	555691	lehtonen1910a	4	42
Ja tätä tehdessään he lauleskelivat.	86193	86229	jarnefelt1913a	4	36
Ja täti on nukkunut.	466607	466627	lehtonen1910a	3	20
Ja täytyyhän Maunon koettaa auttaa sisartaan.	305515	305560	lehtonen1910a	5	45
Ja teidät valitsemme päälliköksi.	158936	158969	canth1886a	3	33
Ja tekisi sen luvattakin.	582060	582085	lehtonen1910a	3	25
Ja tietysti me aina maistelemme.	781859	781891	lehtonen1910a	4	32
Ja tietysti vilpitön.	771197	771218	lehtonen1910a	2	21
Ja tietysti yhäkin mustempia sieluntiloja kohden.	133050	133099	jarnefelt1916a	5	49
Ja todella kirjoitinkin.	136650	136674	jarnefelt1916a	2	24
Ja toiset selittivät käyneensä paljo edempänäkin.	102275	102324	pakkala1895a	5	49
Ja toisille tuli hirveä hätä.	90089	90118	pakkala1895a	4	29
Ja Topi.	511855	511863	lehtonen1910a	1	8
Ja Topikin on kadonnut.	164985	165008	lehtonen1910a	3	23
Ja toukojakin jouduttaa.	319548	319572	lehtonen1910a	2	24
Ja tuli ikävä tyttöjä ja kaikkia.	121781	121814	pakkala1895a	5	33
Ja tulisi siitä huolta.	649421	649444	lehtonen1910a	3	23
Ja tulkaa kaikki.	101879	101896	pakkala1895a	2	17
Ja tultakin sinne pitää kuljettaa.	695269	695303	lehtonen1910a	4	34
Ja tuo kauppias voi ruveta pilkalliseksi.	271075	271116	lehtonen1910a	5	41
Ja tuoleja sohvien välissä ja ympärillä.	329138	329178	lehtonen1910a	5	40
Ja tuolla on tupana laivan kajuutta.	289956	289992	lehtonen1910a	5	36
Ja tuollapa on Topikin, veräjän takana.	538750	538789	lehtonen1910a	5	39
Ja tuosta toisesta välistä ruumenet.	270490	270526	jarnefelt1916a	4	36
Ja tupa ihan hajallaan.	545790	545813	lehtonen1910a	3	23
Ja tupaa voisi kyllä lämmittää.	25555	25586	lehtonen1910a	4	31
Ja tuttiaan imevä Luukas nukkui.	225539	225571	lehtonen1910a	4	32
Ja tynnöri.	184674	184685	lehtonen1910a	1	11
Ja Ulla oli mahtava puolestaan.	88533	88564	pakkala1895a	4	31
Ja usein sainkin tietää jotain lisäksi.	60946	60985	jarnefelt1916a	5	39
Ja usein se siinä kiihtyy.	48844	48870	lehtonen1910a	4	26
Ja uusi huutokin jähmettyy hänelle kurkkuun.	154406	154450	lehtonen1910a	5	44
Ja uusia kuvitteluita tulee.	589619	589647	lehtonen1910a	3	28
Ja vähitellen se hiukan selvenee.	657578	657611	lehtonen1910a	4	33
Ja vaikeni auttamattomasti.	246867	246894	jarnefelt1916a	2	27
Ja vaikka kätkössä olisi raatoja.	799016	799049	lehtonen1910a	4	33
Ja vapisutti kovin.	23669	23688	canth1886a	2	19
Ja varpaat ovat venyneet hirmuisen pitkiksi.	40404	40448	lehtonen1910a	5	44
Ja varsa vavahti lähteäkseen.	131365	131394	jarnefelt1913a	3	29
Ja varsinkin joitakin kivimuureja.	128043	128077	lehtonen1910a	3	34
Ja varsinkin metsäläinen on itsepäinen.	662933	662972	lehtonen1910a	4	39
Ja vedestä nousee usvaa.	11411	11435	lehtonen1910a	3	24
Ja vehnästä on.	447333	447348	lehtonen1910a	2	15
Ja veisaa joskus Mauno-enon Perttakin.	128287	128325	lehtonen1910a	4	38
Ja vetää päätä ikäänkuin makuulle.	503550	503584	lehtonen1910a	4	34
Ja viedä sinne järvelle.	156011	156035	lehtonen1910a	3	24
Ja vielä toisen kerran hän laukaisee.	789655	789692	lehtonen1910a	5	37
Ja vielä toisen, toiselle jalalle.	792583	792617	lehtonen1910a	4	34
Ja viiltää itselleen leivänkannikasta paksun palasen.	142700	142753	lehtonen1910a	5	53
Ja viimein lampun.	791064	791082	lehtonen1910a	2	18
Ja viinatkin ovat talosta loppuneet.	52426	52462	lehtonen1910a	4	36
Ja yhä Kenkkuinniemen päätä kohti.	500796	500830	lehtonen1910a	4	34
Ja yhä tuskaisemmin kyhnyttää Jopikin äitiään.	441924	441970	lehtonen1910a	5	46
Ja yhtäkkiä tulee ruispellon aidan nurkkaus.	612447	612491	lehtonen1910a	5	44
Ja ylenkatseellisesti hän heille nauroi.	340065	340105	lehtonen1910a	4	40
Jää vaan risahti, ei murtunutkaan.	126076	126110	jarnefelt1913a	4	34
Jaa, jaa, keske sisälle.	99500	99524	jarnefelt1913a	3	24
Jaakko oli kiihtyä.	2415	2434	pakkala1895a	2	19
Jaakko seisoi silmänräpäyksen ajan tyrmistyneenä.	3066	3115	pakkala1895a	4	49
Jäät ovat lähteneet vesistä.	6089	6117	lehtonen1910a	3	28
Jag är förlorad, Tyyne.	102254	102277	jarnefelt1913a	3	23
Jag måste anmäla saken.	102745	102768	jarnefelt1913a	3	23
Jaha, vai et tiedä.	596935	596954	lehtonen1910a	3	19
Jäikös, Jöije?	292017	292031	jarnefelt1916a	1	14
Jalkoja jäykistää ja varpaat tulevat punaisiksi.	58730	58778	lehtonen1910a	5	48
Jälleen on kaikki hyvä.	562697	562720	lehtonen1910a	3	23
Järvessä kuultaa monenmuotoisia pilviä.	181084	181123	lehtonen1910a	3	39
Jätin siihen viimeisetkin yritykseni.	247727	247764	jarnefelt1916a	3	37
Jättää Maria Martolan yksikseen.	109282	109314	jarnefelt1913a	3	32
Jauhoja on valunut terävän koivukannon juureen.	383075	383122	lehtonen1910a	5	47
Jauhot antoi.	451908	451921	lehtonen1910a	1	13
Jo ennestään on rähissyt sinulle.	492785	492818	lehtonen1910a	4	33
Jo heittäysi rekeen.	131343	131363	jarnefelt1913a	2	20
Jo johan siitä Joillakin tiesivät puhua.	178192	178232	lassila1910a	5	40
Jo kuumottaa heinälatokin harmaan aidan vierestä.	59202	59251	lehtonen1910a	5	49
Jo minä joudun epätoivoon.	141484	141510	canth1886a	3	26
Jo näkyvissä ollessa silpasi Maija edelle.	14331	14373	pakkala1895a	5	42
Jo nyt parkaisi ja töyttäsi päin.	35563	35596	canth1886a	5	33
Jo on iltapuoli pitkällä.	510763	510788	lehtonen1910a	3	25
Jo on luona.	131330	131342	jarnefelt1913a	2	12
Jo örähtää Juutas vastaan.	156234	156260	lehtonen1910a	3	26
Jo seuraavana aamuna on rietta poissa.	34363	34401	lehtonen1910a	5	38
Jo tahtoivat kädet raueta.	62197	62223	lassila1910a	3	26
Jo tänä päivänä, tänä päivänä.	310979	311009	lehtonen1910a	4	30
Jo tulee mustalle jäälle.	131173	131198	jarnefelt1913a	3	25
Jo tulee Rosina.	81640	81656	lehtonen1910a	2	16
Jo tuli yhden miehen osalle.	719893	719921	lehtonen1910a	4	28
Jo, jo ajoi Yömin pois.	678935	678958	lehtonen1910a	4	23
Johan minä olisin suorastaan naurettava.	266729	266769	jarnefelt1916a	4	40
Johan taas olemme liikkeellä.	3337	3366	jarnefelt1913a	3	29
John antaa teille vapaan vallan.	180165	180197	canth1886a	4	32
John ei häntä estänyt lähtemästä.	181729	181762	canth1886a	4	33
John hymyili.	153535	153548	canth1886a	1	13
John katsoi erästä kirjaa pöydällä.	178765	178800	canth1886a	4	35
John meni ja vei Tyysän mukanaan.	129685	129718	canth1886a	5	33
John meni kamariinsa.	178977	178998	canth1886a	2	21
John meni kamarin ovelle.	177973	177998	canth1886a	3	25
John nousi.	168756	168767	canth1886a	1	11
John peitti kädellä silmiään.	217686	217715	canth1886a	3	29
John rypisti hiukkasen otsaansa.	179396	179428	canth1886a	3	32
John sattui luomaan silmänsä verannalle.	148810	148850	canth1886a	4	40
John silitteli hänen päätään.	118871	118900	canth1886a	3	29
John vähän kummastellen häneen katsoi.	136686	136724	canth1886a	4	38
Johonkin kukolliseen taloon.	42054	42082	lehtonen1910a	2	28
Jöije ajatteli.	72072	72087	jarnefelt1916a	1	15
Jöije ei enää itkenyt.	194651	194673	jarnefelt1916a	3	22
Jöije ei kuitenkaan odottanut minun vastaavan.	292450	292496	jarnefelt1916a	5	46
Jöije ei suomea eikä poika ruotsia.	22616	22651	jarnefelt1916a	5	35
