sentence	start	end	text_name	words	chars
Pantaisiko panska luusalvaa?	279965	279993	lehtonen1910a	2	28
Pantiin toimeen ankaroita tutkistelemuksia.	51241	51284	jarnefelt1913a	3	43
Papattaa kuin monttööri vene.	413588	413617	lehtonen1910a	3	29
Pappa matkusti yksin.	91157	91178	jarnefelt1916a	2	21
Parasta olla kuitenkin täällä.	412600	412630	lehtonen1910a	3	30
Parempi jos itse olisit kertonut heti.	224774	224812	canth1886a	5	38
Parempi olisi ollut Leea.	591674	591699	lehtonen1910a	3	25
Parhaita kirjojakin.	782778	782798	lehtonen1910a	1	20
Pari ikkunoista on auki.	328500	328524	lehtonen1910a	3	24
Parissa talossa hän kävi kysymässä renginpaikkaa.	654372	654421	lehtonen1910a	5	49
Parooni ilmestyi vihdoin saliin.	35914	35946	jarnefelt1916a	3	32
Parooni kysyi, olenko tulkinnut kaiken.	44473	44512	jarnefelt1916a	4	39
Paroonitar syleili minua toistamiseen.	26381	26419	jarnefelt1916a	3	38
Paroonittaren tapasin hänen sisimmästä huoneestaan.	15604	15655	jarnefelt1916a	4	51
Pässi hyökkää.	685316	685330	lehtonen1910a	1	14
Pässi päkkää, ja Sanelma kirkaisee.	686252	686287	lehtonen1910a	4	35
Pässikö on puskenut, Topi?	86416	86442	lehtonen1910a	3	26
Pässikö?	432080	432088	lehtonen1910a	0	8
Pässin silmät kiiluivat mustina päässä.	78971	79010	lehtonen1910a	4	39
Pastori kuitenkin joutui ennen perille.	78972	79011	canth1886a	4	39
Pateettista niinkuin mikäkin sankariruno.	784043	784084	lehtonen1910a	3	41
Paussi.	107956	107963	jarnefelt1913a	0	7
Pelkään sen unen uudistuvan.	142255	142283	jarnefelt1913a	3	28
Pellolta kuuluu silloin yöllä möreä hyräily.	50025	50069	lehtonen1910a	5	44
Pelosta ei ollut jälkeäkään.	81115	81143	jarnefelt1916a	3	28
Pelotti, että äiti ei laittaisikaan sitten.	47015	47058	pakkala1895a	5	43
Pennut kiljuvat.	86210	86226	lehtonen1910a	1	16
Pennut ovat tulleet ovelta katselemaan.	107087	107126	lehtonen1910a	4	39
Pennut.	420829	420836	lehtonen1910a	0	7
Pentuja ei näy pihalla.	421073	421096	lehtonen1910a	3	23
Perääntyen minä karahutan takajaloilleni.	125738	125779	jarnefelt1913a	3	41
Perämiehen iso rahalaukku kalisee jo tuolla.	250164	250208	lehtonen1910a	5	44
Perhe on vaiti, jörösti ja loukkaantuneena.	143902	143945	lehtonen1910a	5	43
Perheestä on osa kömpinyt saunasta sinne.	68201	68242	lehtonen1910a	5	41
Pertan Sanelma on siihen aivan valmis.	570307	570345	lehtonen1910a	5	38
Pertan vuoksi jäi Juutaksen kysely tekemättä.	708065	708110	lehtonen1910a	5	45
Pertta heitä vähän ärsytti.	486786	486813	lehtonen1910a	3	27
Pertta ja iso Sanelma haravoivat.	624615	624648	lehtonen1910a	4	33
Pertta Kinnunen näet tahtoi syömistä.	742751	742788	lehtonen1910a	4	37
Pertta vaikenee tuokioksi.	696432	696458	lehtonen1910a	2	26
Perunat ovat aikoja sitten keitetyt.	462644	462680	lehtonen1910a	4	36
Perunat pyörähtävät kuitenkin maahan.	121298	121335	lehtonen1910a	3	37
Petäjä oli melkein hänen kokoisensa.	585636	585672	lehtonen1910a	4	36
Petäjät suhisevat hiljaisessa tuulessa.	112766	112805	lehtonen1910a	3	39
Pettymyksen viha sälähti mielessä.	30307	30341	pakkala1895a	3	34
Petu kiiruusti pakoon, että hame viuhkasi.	35597	35639	canth1886a	5	42
Petu meni ja nykäisi häntä takaa.	35290	35323	canth1886a	5	33
Petu nykäisi toisen kerran.	35408	35435	canth1886a	3	27
Petuko antoi?	9693	9706	canth1886a	1	13
Pian joudutaan ulapalle.	2935	2959	lehtonen1910a	2	24
Pian on kaikki tipot viety.	435313	435340	lehtonen1910a	4	27
Pian se voi täälläkin romahtaa.	511524	511555	lehtonen1910a	4	31
Pianpa se kävikin.	75429	75447	canth1886a	2	18
Pidellyt lauhkeasti kuin pesusienellä.	779134	779172	lehtonen1910a	3	38
Pieksää, ja silmät säkenöivät vimmasta.	120867	120906	lehtonen1910a	4	39
Pienestä pitäen ei, muuta kuin sairautta.	34659	34700	canth1886a	5	41
Pieni poika herkeää itkemästä.	81912	81942	lehtonen1910a	3	30
Pihalla kuorsataan ja nukutaan.	475486	475517	lehtonen1910a	3	31
Pihalle jää Lyygia.	648217	648236	lehtonen1910a	2	19
Piilee kuin mäyrä omassa kolossaan.	290082	290117	lehtonen1910a	4	35
Piippu hampaissa hän oli niittänyt.	705295	705330	lehtonen1910a	4	35
Piippu lerpatti hampaissa ihan tipahtamaisillansa.	229510	229560	lassila1910a	4	50
Piippu putoaa sammalikkoon.	382367	382394	lehtonen1910a	2	27
Piippu suussa mörötti yksinään tuossa penkillä.	520174	520221	lehtonen1910a	5	47
Piippu toki löytyi.	382554	382573	lehtonen1910a	2	19
Piippu turisee.	382084	382099	lehtonen1910a	1	15
Piippu vain lepatti putoamistansa odotellen.	1835	1879	lassila1910a	4	44
Piisaa tämä minulle.	722680	722700	lehtonen1910a	2	20
Pikku Anni väänteli itseään kätkyessä.	51853	51891	canth1886a	4	38
Pikku Luukas se siellä itkee.	223351	223380	lehtonen1910a	4	29
Pikku Sanelma asettuu heti nenälleen maahan.	642913	642957	lehtonen1910a	5	44
Pikku Sanelma ei vastaa.	539220	539244	lehtonen1910a	3	24
Pikku Sanelma hihittää ja hyppii.	724494	724527	lehtonen1910a	4	33
Pikku Sanelma hihkuu ja hyppelee.	401229	401262	lehtonen1910a	4	33
Pikku Sanelma ja Topi juoksevat pihalle.	693263	693303	lehtonen1910a	5	40
Pikku Sanelma seisoo koivet pystyssä.	643494	643531	lehtonen1910a	4	37
Pikku Sanelma suuttuu.	645579	645601	lehtonen1910a	2	22
Pikku Sanelma tahtoo kahvia.	441895	441923	lehtonen1910a	3	28
Pikku Sanelma tirskuu.	459178	459200	lehtonen1910a	2	22
Pikku Sanelmakaan ei tirsku.	725385	725413	lehtonen1910a	3	28
Pikku Sanelmakin hiipii yhteiselle onkipaikalle.	626749	626797	lehtonen1910a	4	48
Pikku Sanelman ja Jopin.	663570	663594	lehtonen1910a	3	24
Pikku sisko lyö yhä.	120945	120965	lehtonen1910a	3	20
Pilkistelee joka taholle.	259446	259471	lehtonen1910a	2	25
Pilvenhattarat liikkuvat riemullisina ilmavalla taivaalla.	223074	223132	lehtonen1910a	4	58
Pilvet ovat kuin ruusuisia vivahteita helmiäisissä.	650553	650604	lehtonen1910a	5	51
Pilvistä se vivahdus tulee.	610849	610876	lehtonen1910a	3	27
Pimeä metsä raikuu.	788465	788484	lehtonen1910a	2	19
Piruako se siellä tekee?	168843	168867	lehtonen1910a	3	24
Pistävä ja voimakas haju.	132365	132390	lehtonen1910a	3	25
Pitää köllötellä syrjässä.	587244	587270	lehtonen1910a	2	26
Pitää mennä ottamaan metsästä äyskäri.	171918	171956	lehtonen1910a	4	38
Pitää nauttia siitä, mitä vielä saa.	587207	587243	lehtonen1910a	5	36
Pitää panna pojat ja tytöt työhön.	390945	390979	lehtonen1910a	5	34
Pitäähän niille rakkaille antaa.	517530	517562	lehtonen1910a	3	32
Pitääkös sille pienelle tittiä?	520649	520680	lehtonen1910a	3	31
Pitäisi jo toki olla vähän ymmärtäväisempi.	157062	157105	jarnefelt1913a	5	43
Pitäisi se Rosina saada leppymään.	145250	145284	lehtonen1910a	4	34
Pitäisi sitä köyhiä auttaa.	74914	74941	lehtonen1910a	3	27
Pitäisikö sillekin ostaa lappu?	250263	250294	lehtonen1910a	3	31
Pitäköön Saara itsestään huolen.	250420	250452	lehtonen1910a	3	32
Pite kesi alhalla.	99794	99812	jarnefelt1913a	2	18
Pitemmät ovat Martin, lyhemmät Jöijen, ajattelin.	101578	101627	jarnefelt1916a	5	49
Piti päivettyä ja saada jänteitä käsivarsiinsa.	62066	62113	jarnefelt1916a	5	47
Pitkän aikaa ja hiljaa.	257172	257195	lehtonen1910a	3	23
Pöh, pöh.	701921	701930	lehtonen1910a	1	9
Pohjiaan myöten heidän, oikein oma.	60568	60603	lehtonen1910a	4	35
Poika ei ole millänsäkään.	401169	401195	lehtonen1910a	3	26
Poika värisi vilusta ohkaisessa hameessaan.	30252	30295	canth1886a	4	43
Poika vetää miestä kiirehtimään.	257704	257736	jarnefelt1916a	3	32
Poika yhä parkui; pelkäsi hänelle annettavan.	10824	10869	canth1886a	5	45
Poikki heinäkarheiden.	500622	500644	lehtonen1910a	1	22
Pois kaikenlaisista kotoisista kärhäyksistä.	638795	638839	lehtonen1910a	3	44
Pois minä lähden täältä.	311391	311415	lehtonen1910a	3	24
Pois pateettisuus.	787677	787695	lehtonen1910a	1	18
Poissa pölyäviltä kaduilta, selluloosatehtaiden tuoksusta.	765536	765594	lehtonen1910a	4	58
Pojan riemu yltyi.	107344	107362	lassila1910a	2	18
Pojat hämmästyivät.	9192	9211	pakkala1895a	1	19
Pojat remahtivat nauramaan.	11429	11456	pakkala1895a	2	27
Pojatkin istuivat nyt hiljaa, yhdessä kohden.	74430	74475	canth1886a	5	45
Poliisia löi.	323175	323188	lehtonen1910a	1	13
Polttaa käsiä.	658829	658843	lehtonen1910a	1	14
Polttopuita hän kantaa, kahvinkeittoa varten.	314074	314119	lehtonen1910a	4	45
Polutonta rinnettä, sakeaan viidakkoon.	500756	500795	lehtonen1910a	3	39
Polvillaan hänen vieressään: Anton, koeta rauhoittua.	102158	102211	jarnefelt1913a	5	53
Porkin kasvot pöhöttivät veripunaisina.	238806	238845	lassila1910a	3	39
Porsaasta johtuivat ajatukset Kaisan taloon.	229013	229057	lassila1910a	4	44
Porsas alkoi telmää olilla.	228168	228195	lassila1910a	3	27
Porsas pyöräytti saparoaan ja poika riemuitsi.	107084	107130	lassila1910a	5	46
Porsas tuntui hänestä jo ihan läheiseltä.	138502	138543	lassila1910a	5	41
Porsas vingahteli.	112675	112693	lassila1910a	1	18
Porsas vinkui säkissä kuin syötävä.	136429	136464	lassila1910a	4	35
Porsas vinkui säkissä selässä.	152630	152660	lassila1910a	3	30
Porsas vinkui taas säkissä.	148251	148278	lassila1910a	3	27
Porsaskin joskus örähtelee.	689305	689332	lehtonen1910a	2	27
Poskesta näkyi, että hän vähä hymyili.	91926	91964	jarnefelt1916a	5	38
Posket olivat kalpeat ja katse sumea.	234286	234323	canth1886a	5	37
Poskia poltteli ja korvat humisivat.	62202	62238	pakkala1895a	4	36
Poskia poltteli.	37099	37115	pakkala1895a	1	16
Potatteja hän kuitenkin suosii erityisesti.	196039	196082	lehtonen1910a	4	43
Potkivat Maunon pois.	301978	301999	lehtonen1910a	2	21
Pöydän toisessa päässä istui Käkriäinen.	352110	352150	lehtonen1910a	4	40
Pöytä oli katettu verannalle.	110337	110366	canth1886a	3	29
Puhdistelee marjoja mummolle.	512210	512239	lehtonen1910a	2	29
Puhele kanssani etten nuku.	142227	142254	jarnefelt1913a	3	27
Puhkuvaa ruispuuroa, voisilmässä kastettua.	465162	465205	lehtonen1910a	3	43
Puhutaan siitä asiasta.	767881	767904	lehtonen1910a	2	23
Puhuttiin muista vähemmän tärkeistä asioista.	123139	123184	lassila1910a	4	45
Pujahdin sisään samaan ovensuljentaan.	15564	15602	jarnefelt1916a	3	38
Pujahtavat Muttisen ja Topin sivuitse sisälle.	670822	670868	lehtonen1910a	5	46
Punainen se on.	505286	505301	lehtonen1910a	2	15
Punainen tulikettu.	25920	25939	lehtonen1910a	1	19
Punaisessa mekossa.	505302	505321	lehtonen1910a	1	19
Punaisista pilvistä se hohtaa.	626320	626350	lehtonen1910a	3	30
Punertava se on ja korkea.	10410	10436	lehtonen1910a	4	26
Puoleen hintaan se putoaa ainakin.	376225	376259	lehtonen1910a	4	34
Puolitiessä mäkeä kääntyy hän yhtäkkiä.	234837	234876	lehtonen1910a	4	39
Puoshaan kärki puskee nuottakodan lahonneeseen salvaimeen.	534592	534650	lehtonen1910a	5	58
Puree hammasta ja kömpii ylös kuopasta.	397817	397856	lehtonen1910a	5	39
Pussin työntää hän lihavaan poveensa.	573134	573171	lehtonen1910a	4	37
Putkinotkon Käkriäinen ilostuu jälleen.	366540	366579	lehtonen1910a	3	39
Putkinotkon lammelle.	606388	606409	lehtonen1910a	1	21
Putkinotkon lehmätkin ammuvat nyt viidakossa lähellä.	403868	403921	lehtonen1910a	5	53
Putkinotkon mökille on varmaan tullut vieraita.	405688	405735	lehtonen1910a	5	47
Putkinotkosta?	349785	349799	lehtonen1910a	0	14
Puukolle olisi pitänyt maksaa.	345029	345059	lehtonen1910a	3	30
Puutos on julma.	252767	252783	lassila1910a	2	16
Puuttuu saunajuoma, tuoppi piimää.	698132	698166	lehtonen1910a	3	34
Pyörii, kaivaa sammalta.	383399	383423	lehtonen1910a	2	24
Pyörryttääkö?	223711	223724	canth1886a	0	13
Pyörtyiköhän Jopi?	717284	717302	lehtonen1910a	1	18
Pyrki sulamaan kaikki nauruun.	27116	27146	pakkala1895a	3	30
Pysyi siellä nurkan takana keinoa miettiäkseen.	561928	561975	lehtonen1910a	5	47
Pysykää nyt lähellä.	28393	28413	canth1886a	2	20
Pyydäpä sellaista neitiä mihinkään.	591546	591581	lehtonen1910a	3	35
Pyydettävä se on.	270908	270925	lehtonen1910a	2	17
Pyytää Topia tuomaan itselleen kodasta piimää.	720126	720172	lehtonen1910a	5	46
Qu'est ce que c'est donc?	104939	104964	jarnefelt1913a	4	25
Raatona.	182197	182205	lehtonen1910a	0	8
Rahatuusahan jäi kotiin.	263151	263175	lehtonen1910a	2	24
Rahojaan oli Jopi viipynyt rannalla tarkastamassa.	433277	433327	lehtonen1910a	5	50
Rakastaapa hän lapsiaan ja omaa sikaansa.	203233	203274	lehtonen1910a	5	41
Rakastanhan sinua koko sielullani.	134716	134750	canth1886a	3	34
Rakennukset ovat rinteellä, hiukan ylempänä rantaäyrästä.	7862	7919	lehtonen1910a	5	57
Rakkaasti oli Fanny silloin häneen katsellut.	589953	589998	lehtonen1910a	5	45
Rakkahin Hiljani, mitähän sinäkin minusta ajattelet?	169374	169426	jarnefelt1916a	5	52
Rannalla läpisevät haavat aamuviluisesti.	11369	11410	lehtonen1910a	3	41
Rannat alkoivat lipua vielä nopeammin ohitse.	79324	79369	jarnefelt1916a	5	45
Rannat kaikki kajahtelevat.	153465	153492	lehtonen1910a	2	27
Rannat laskeutuvat paikoittain pystysuorina veteen.	181892	181943	lehtonen1910a	4	51
Rauhaa minä tahdon.	766553	766572	lehtonen1910a	2	19
Rauhassa minä tahdon olla ja lueksia.	778946	778983	lehtonen1910a	5	37
Raukeana tahdottomana rauhana.	75687	75717	kilpi1903a	2	30
Räystäistä ei enää tippunut.	98976	99004	jarnefelt1916a	3	28
Rehevä on se heisi niinkuin nokkospehko.	115649	115689	lehtonen1910a	5	40
Rehtori kalpeni.	54020	54036	jarnefelt1913a	1	16
Reiästä pilkistelee Jopin tukka.	84466	84498	lehtonen1910a	3	32
Reipastelu onnistui Leppäselle aluksi vallan mainiosti.	33787	33842	jarnefelt1916a	5	55
Reisvänni hän on nimeltään.	289245	289272	lehtonen1910a	3	27
Reki vedetään hiljaa vajasta.	123371	123400	jarnefelt1913a	3	29
Repaleiset nuo ovat lapset.	203275	203302	lehtonen1910a	3	27
Repekka anelee taas voileipää.	517461	517491	lehtonen1910a	3	30
Repekka itkaisee taas.	640633	640655	lehtonen1910a	2	22
Repekka itkee tuvassa.	756299	756321	lehtonen1910a	2	22
Repekka ja Ester kinastelevat karamelleistä.	567541	567585	lehtonen1910a	4	44
Repekka ja Sanelma matkivat Topia.	642150	642184	lehtonen1910a	4	34
Repekka juoksee Hurjan kimppuun.	639817	639849	lehtonen1910a	3	32
Repekka kirkuu riemusta.	639936	639960	lehtonen1910a	2	24
Repekka matkii koiraa.	640081	640103	lehtonen1910a	2	22
Repekka pyörähtää ja vilkaisee Ananiakseen.	71007	71050	lehtonen1910a	4	43
Repekka tahtoo Moksin kiinni.	640448	640477	lehtonen1910a	3	29
Repekka tirkisteli pihalle nostettuna ensin aurinkoon.	70183	70237	lehtonen1910a	5	54
Repekkaa, Herran terttua.	325313	325338	lehtonen1910a	2	25
Repi aidan hovin lehmille auki.	345172	345203	lehtonen1910a	4	31
Repiä ne pitäisi kaikki pois.	504306	504335	lehtonen1910a	4	29
Reumatismi on niin sanoakseni sukuvika meissä.	6583	6629	jarnefelt1913a	5	46
Riemukas ja samalla alakuloinen laulu.	471426	471464	lehtonen1910a	4	38
Riemulla ne nyt ryntäsivät kaikki esille.	242286	242327	canth1886a	5	41
Rientää ulos haltioituneena äärimmilleen.	159703	159744	jarnefelt1913a	3	41
Riihen kupeelle sen lapset paimensivat.	202635	202674	lehtonen1910a	4	39
Riittäisiköhän sitä iloa nyt hyvinkin kauan?	764624	764668	lehtonen1910a	5	44
Ripatillakin ostattaa, vilskommipelillä.	453125	453165	lehtonen1910a	2	40
Ripatista on Konstalle hyödykkiä metsäkaupoissa.	340782	340830	lehtonen1910a	4	48
Ripatti on lurjus.	342526	342544	lehtonen1910a	2	18
Rippikoulun linnassa käynyt.	493068	493096	lehtonen1910a	2	28
Ristit ottivat uhkaavan muodon.	238955	238986	canth1886a	3	31
Riuhtoen hän sen sitoo.	385476	385499	lehtonen1910a	3	23
Rivakasti soutaa Rosina kapean salmen yli.	287011	287053	lehtonen1910a	5	42
Rohtojen avulla, ellei muuten.	221554	221584	canth1886a	3	30
Rosina ällistyy, ja puhkeaa hiljaiseen nauruun.	259607	259654	lehtonen1910a	5	47
Rosina ällistyy.	553386	553402	lehtonen1910a	1	16
Rosina avaa silmänsä.	510949	510970	lehtonen1910a	2	21
Rosina heiluttaa nyrkkiään, jossa kengät roikkuvat.	421895	421946	lehtonen1910a	5	51
Rosina huomaa siinä Jopin.	755382	755408	lehtonen1910a	3	26
Rosina innostuu, että onpas viisailla konstinsa.	309758	309806	lehtonen1910a	5	48
Rosina jää pihalle.	573452	573471	lehtonen1910a	2	19
Rosina juoksee siihen kesken kiireitään.	641650	641690	lehtonen1910a	4	40
Rosina juoksee sinne.	511994	512015	lehtonen1910a	2	21
Rosina juoksee ulos.	521989	522009	lehtonen1910a	2	20
Rosina käännähtää ihmeissään.	553236	553265	lehtonen1910a	2	29
Rosina käännähtää.	421730	421748	lehtonen1910a	1	18
Rosina Käkriäinen on hyvillään jauhoista.	426207	426248	lehtonen1910a	4	41
Rosina Käkriäisen ja lasten ääniä.	611693	611727	lehtonen1910a	4	34
Rosina Käkriäistä lähellä on paljon veneitä.	284535	284579	lehtonen1910a	5	44
Rosina katsoo hetken miesten menoa.	756144	756179	lehtonen1910a	4	35
Rosina koettaa sitä hyssytellä uneen.	520817	520854	lehtonen1910a	4	37
Rosina kulkee kantamuksineen ylemmäksi, Potamian taustalle.	288786	288845	lehtonen1910a	5	59
Rosina kuuntelee kujalla saunalle päin.	734573	734612	lehtonen1910a	4	39
Rosina melkein itkee kiukusta.	108378	108408	lehtonen1910a	3	30
Rosina menee lähemmäksi Maunoa.	573641	573672	lehtonen1910a	3	31
Rosina menee ruokakonttoriin.	517563	517592	lehtonen1910a	2	29
Rosina murahtaa jotain mummolle.	512613	512645	lehtonen1910a	3	32
Rosina näytti huolestuneelta.	707733	707762	lehtonen1910a	2	29
Rosina näytti sen minulle.	689406	689432	lehtonen1910a	3	26
Rosina odottaa jännityksessä.	550329	550358	lehtonen1910a	2	29
Rosina oli siepannut ne häneltä pois.	740831	740868	lehtonen1910a	5	37
Rosina oli vilkaissut ulos ikkunasta.	545395	545432	lehtonen1910a	4	37
Rosina on hyvillään.	518805	518825	lehtonen1910a	2	20
Rosina on ihan hiljaa.	99200	99222	lehtonen1910a	3	22
Rosina on kuin tuli ja leimaus.	100462	100493	lehtonen1910a	5	31
Rosina on melkeinpä lyhytkasvuinen.	45208	45243	lehtonen1910a	3	35
Rosina on menetellyt niinkuin on voinut.	464585	464625	lehtonen1910a	5	40
Rosina on noussut pystyyn.	102278	102304	lehtonen1910a	3	26
Rosina on saanut Esterin valmiiksi.	548003	548038	lehtonen1910a	4	35
Rosina on sekaantunut ja loukkaantunut.	279840	279879	lehtonen1910a	4	39
Rosina on suuttunut.	280240	280260	lehtonen1910a	2	20
Rosina on tullut takaisin sisään.	453993	454026	lehtonen1910a	4	33
Rosina pisti kiireesti uunin lämpiämään.	617627	617667	lehtonen1910a	4	40
Rosina rientää paraikaa ylös mökille.	613828	613865	lehtonen1910a	4	37
Rosina rupeaa jo myöntelemään.	558273	558303	lehtonen1910a	3	30
Rosina ryntää pihalle.	421129	421151	lehtonen1910a	2	22
Rosina säkättää Topille.	685331	685355	lehtonen1910a	2	24
Rosina se siellä huutaa.	628953	628977	lehtonen1910a	3	24
Rosina selittää vähän lisää.	746073	746101	lehtonen1910a	3	28
Rosina selitti sen likaantuvan.	546528	546559	lehtonen1910a	3	31
Rosina toi sen porsaan veneellä, säkissä.	337064	337105	lehtonen1910a	5	41
Rosina tulee saunasta.	755160	755182	lehtonen1910a	2	22
Rosina työnnäiksen tien tulpaksi.	500014	500047	lehtonen1910a	3	33
Rosina työntää Esterin päälle vanhaa mekkoa.	547375	547419	lehtonen1910a	5	44
Rosina vie hänet sisään.	756356	756380	lehtonen1910a	3	24
Rosinaa epäröittää.	278084	278103	lehtonen1910a	1	19
Rosinahan se oli.	675978	675995	lehtonen1910a	2	17
Rosinakaan ei heitä enää näe.	496303	496332	lehtonen1910a	4	29
Rosinalla on huolensa.	323844	323866	lehtonen1910a	2	22
Rosinalla on taikinanjuuri jo valmis happanemaan.	456514	456563	lehtonen1910a	5	49
Rosinalle itselleenkin se nyt tekee vahingon.	501552	501597	lehtonen1910a	5	45
Rosinan kieli laukeaa vähitellen.	557017	557050	lehtonen1910a	3	33
Rosinan mieli myrtyy Saaraa ajatellessa.	740401	740441	lehtonen1910a	4	40
Rosinan sydän on lämminnyt.	739361	739388	lehtonen1910a	3	27
Rosinan sydäntä ennättää parahiksi epäilyttämään.	273929	273978	lehtonen1910a	4	49
Roska silmässä.	3397	3412	jarnefelt1913a	1	15
Rouva aina vaan panee leikiksi.	99077	99108	canth1886a	4	31
Rouva Karell, mitä on tapahtunut?	195998	196031	canth1886a	4	33
Rovasti ja kappalainen tulivat sisälle.	81575	81614	jarnefelt1913a	4	39
Ruohikko tuoksuaa.	644324	644342	lehtonen1910a	1	18
Ruoho puiden juuressa on kaunista.	609392	609426	lehtonen1910a	4	34
Ruokasalin oven luona puhelin.	89946	89976	jarnefelt1913a	3	30
Ruotsimieliset pitävät puoliaan, se on luonnollista.	144695	144747	canth1886a	5	52
Rupeatko remmiin, vai et?	488687	488712	lehtonen1910a	3	25
Rupeatko?	489921	489930	lehtonen1910a	0	9
Rupeisiko ehkä sohvalle omassa huoneessaan?	133576	133619	canth1886a	4	43
Rupesimme juomaan teetä.	189561	189585	jarnefelt1916a	2	24
Rupesin lukemaan.	139457	139474	jarnefelt1916a	1	17
Rupesipa sopertamaan suomeakin.	44942	44973	jarnefelt1916a	2	31
Rusinansyöjän kanssa.	764041	764062	lehtonen1910a	1	21
Ruskeat kengät isoissa jaloissaan.	548464	548498	lehtonen1910a	3	34
Ruumis on kääntynyt uuniin päin.	331276	331308	lehtonen1910a	4	32
Ruumis värisi.	60876	60890	canth1886a	1	14
Rynkyttämällä ei vesi kaatuisi niin joutuisasti.	171392	171440	lehtonen1910a	5	48
Ryssä möi kaupungissa.	151051	151073	lehtonen1910a	2	22
Saa menne.	100493	100503	jarnefelt1913a	1	10
Saahan sitä niiden paperien nojalla.	229999	230035	lehtonen1910a	4	36
Saako olla?	95428	95439	jarnefelt1913a	1	11
Säälikin tuli Ihalaista.	82692	82716	lassila1910a	2	24
Saanko tarjota teetä?	106244	106265	jarnefelt1913a	2	21
Saara ei kuule.	254210	254225	lehtonen1910a	2	15
Saara huomauttaa, että päivän läätäminen päivetyttää.	180839	180892	lehtonen1910a	5	53
Saara ja Ananias purskahtavat nauruun.	147379	147417	lehtonen1910a	4	38
Saara jatkaa nurisemistaan.	139019	139046	lehtonen1910a	2	27
Saara kiertää vielä ahon yläreunaa myöten.	609165	609207	lehtonen1910a	5	42
Saara köntystää ohitse saunaan.	459201	459232	lehtonen1910a	3	31
Saara kuorsaa.	441087	441101	lehtonen1910a	1	14
Saara kuulee, mitä neiti puhuu raja-aidoista.	604233	604278	lehtonen1910a	5	45
Saara nauraa, iloisemmin kuin Rosina.	147919	147956	lehtonen1910a	4	37
Saara oli silloin tuvassa yksinään.	740539	740574	lehtonen1910a	4	35
Saara on innostunut kertomaan tervahöyrystä.	142755	142799	lehtonen1910a	4	44
Saara on noussut aivan äidin luokse.	255904	255940	lehtonen1910a	5	36
Saara pukeutuu kodan penkillä.	744426	744456	lehtonen1910a	3	30
Saara sanonut, että hän on leipäsusi.	495283	495320	lehtonen1910a	5	37
Saara se on.	608978	608990	lehtonen1910a	2	12
Saara teristää korviaan.	603732	603756	lehtonen1910a	2	24
Saara vaikenee hetkeksi.	138754	138778	lehtonen1910a	2	24
Saara vannoskeli puhuvansa totta.	622420	622453	lehtonen1910a	3	33
Saara, kuule, se on ruvettava työhön.	624365	624402	lehtonen1910a	5	37
Saaraa ei haluta heittää häränpyllyä.	643652	643689	lehtonen1910a	4	37
Saaralla on ne punaiset sukat.	132796	132826	lehtonen1910a	4	30
Saaran nappikengät, housunsuiden päälle vedetyt, kolisevat.	151930	151989	lehtonen1910a	5	59
Saaran päätä pakottaa.	454897	454919	lehtonen1910a	2	22
Saarankin ajaa moinen makuulta.	85184	85215	lehtonen1910a	3	31
Saaret ja niemet verhoutuvat siniseen autereeseen.	6259	6309	lehtonen1910a	5	50
Saarukka.	645005	645014	lehtonen1910a	0	9
Saattaa siitä asiasta vielä tulla tosikin.	135622	135664	lehtonen1910a	5	42
Saattaako semmoista kertoa edes Hiljalle?	87479	87520	jarnefelt1916a	4	41
Saattoihan mokoman edessä olla sitäkin.	63409	63448	jarnefelt1916a	4	39
Sadastiko teitä täytyy pökyyttää.	565758	565791	lehtonen1910a	3	33
Sahan hovilleko ja myllylle?	106413	106441	lehtonen1910a	3	28
Sairasvoimistelua.	6017	6035	jarnefelt1913a	0	18
Sairautta ja tautia, kurjuutta kaikenmoista.	81354	81398	canth1886a	4	44
Saisihan hän sen sitten tultuakin tietää.	47490	47531	lassila1910a	5	41
Saisiko olla filemoonia?	278258	278282	lehtonen1910a	2	24
Saisivat elinkaudeksi viedä.	185127	185155	lehtonen1910a	2	28
Säkki on vieressä kivellä.	381497	381523	lehtonen1910a	3	26
Säkkiin.	311310	311318	lehtonen1910a	0	8
Säksättäköön Pertta hänen takanaan, ja Rosinakin.	500340	500389	lehtonen1910a	5	49
Salin ikkunoista on otettu pois sanomalehtipaperit.	598135	598186	lehtonen1910a	5	51
Salin lattiaa ei vielä oltu pesty.	154608	154642	canth1886a	5	34
Salissa jatkettiin keskustelua tyynesti ja tasaisesti.	224961	225015	canth1886a	5	54
Sallittaisiinko heidän elää yhä Putkinotkossa?	739389	739435	lehtonen1910a	4	46
Sama kuoleman hiljaisuus.	52894	52919	jarnefelt1913a	2	25
Sama on Juutas ollut ikänsä.	52913	52941	lehtonen1910a	4	28
Sama on kuvernörin laita.	45806	45831	jarnefelt1913a	3	25
Samalla iski hän silmää Jussille.	147170	147203	lassila1910a	4	33
Samalla tavalla ravisteli Aapeli tässäkin itseään.	668563	668613	lehtonen1910a	5	50
Samanikäinen on heidän porsaansa kuin nämäkin.	337106	337152	lehtonen1910a	5	46
Samanne päinkin katsoivat aina.	101244	101275	lassila1910a	3	31
Samassa kavahti Mari istumaan.	38890	38920	canth1886a	3	30
Samassa kuulen kulkusten helinän pihalta.	254780	254821	jarnefelt1916a	4	41
Samassa Martti nousi seisaalleen.	286697	286730	jarnefelt1916a	3	33
Samassa tuli äiti sisään.	2867	2892	pakkala1895a	3	25
Samassa tulivat kaikki pojat ulos.	60533	60567	jarnefelt1913a	4	34
Samat olivat, eikä kuitenkaan samat.	194639	194675	canth1886a	4	36
Samoin Maunon, läävälle ja korsulle päin.	756222	756263	lehtonen1910a	5	41
Samoin tunteet ja ajatukset.	211386	211414	canth1886a	3	28
Sanelma ajaa Topia takaa.	227786	227811	lehtonen1910a	3	25
Sanelma antaa Jopille namusia.	555068	555098	lehtonen1910a	3	30
Sanelma ei tottele.	398922	398941	lehtonen1910a	2	19
Sanelma hymyilee hänelle, niinkuin aina muillekin.	634496	634546	lehtonen1910a	5	50
Sanelma hypähtelee ilosta.	554474	554500	lehtonen1910a	2	26
Sanelma innostuu.	220114	220131	lehtonen1910a	1	17
Sanelma itkee ja kiroilee.	535773	535799	lehtonen1910a	3	26
Sanelma ja Jopi juoksevat pihalle.	664584	664618	lehtonen1910a	4	34
Sanelma loikoo permannolla.	304548	304575	lehtonen1910a	2	27
Sanelma menee ovelle.	554813	554834	lehtonen1910a	2	21
Sanelma on komennettu sitä katsomaan.	224907	224944	lehtonen1910a	4	37
Sanelma on menossa alaveräjälle.	539318	539350	lehtonen1910a	3	32
Sanelma vilkaisee maahan, vilkkuu syrjään.	227069	227111	lehtonen1910a	4	42
