sentence	start	end	text_name	words	chars
Me käpälämäkeen.	61397	61413	jarnefelt1913a	1	16
Me saatoimme vapaasti katsoa toisiamme silmiin.	224073	224120	jarnefelt1916a	5	47
Me teemme liiton.	158918	158935	canth1886a	2	17
Meidän pitäisi saada totia alas lehtimajaan.	101831	101875	canth1886a	5	44
Meidän täytyy heti lähteä Marttia tapaamaan.	98682	98726	jarnefelt1916a	5	44
Meidän venettäkin kuljettelevat kaikeksi päivää.	248805	248853	lehtonen1910a	4	48
Meillä ei ole oikeaa asuntoa.	307029	307058	lehtonen1910a	4	29
Meillä oli miehiä vieraina.	42023	42050	pakkala1895a	3	27
Meillä oli mökki alhaalla harjun rinteellä.	67602	67645	jarnefelt1913a	5	43
Meissä ei ole tarmoa eikä jäntevyyttä.	144656	144694	canth1886a	5	38
Melkein mihinkään pehmoiseen astumatta.	543969	544008	lehtonen1910a	3	39
Mene heti pois.	162088	162103	canth1886a	2	15
Menee eteiseen.	141554	141569	jarnefelt1913a	1	15
Menee hetki.	520732	520744	lehtonen1910a	1	12
Menee kyökkiin.	93248	93263	jarnefelt1913a	1	15
Menee kyökkiin.	118521	118536	jarnefelt1913a	1	15
Menee nuottakodalle asti.	726332	726357	lehtonen1910a	2	25
Menee saunaan.	711233	711247	lehtonen1910a	1	14
Menee tainnoksiin poliisin ja Vanhan-Liisan syliin.	113128	113179	jarnefelt1913a	5	51
Menee tuokio.	677197	677210	lehtonen1910a	1	13
Menee, tehtyään sotilaskäänteen.	100550	100582	jarnefelt1913a	2	32
Menestys seurasi häntä.	16359	16382	jarnefelt1913a	2	23
Menevät minne Luoja sallii.	324737	324764	lehtonen1910a	3	27
Menge hakeman kersanti.	98957	98980	jarnefelt1913a	2	23
Meni rantaveräjälle.	388383	388403	lehtonen1910a	1	20
Menimme yhdessä.	283827	283843	jarnefelt1916a	1	16
Menköön Saara.	569570	569584	lehtonen1910a	1	14
Menköön Topi, jos ei Sanukka varpaaltaan.	568403	568444	lehtonen1910a	5	41
Mennään Kotkaan.	302379	302395	lehtonen1910a	1	16
Mennään niemen ympäri.	604188	604210	lehtonen1910a	2	22
Mennäänkö pois tästä?	270119	270140	lehtonen1910a	2	21
Mennäänkö?	283744	283754	jarnefelt1916a	0	10
Merille lähtemisestä minä sentään kysyin Jöijeltä.	107190	107240	jarnefelt1916a	5	50
Merkitsin paikan neljällä paalulla.	86002	86037	jarnefelt1913a	3	35
Mesopotamialaisia, muka marjamatkoilla.	599124	599163	lehtonen1910a	2	39
Metsä lakkaa kaiuttamasta Hurjan haukuntaa.	412764	412807	lehtonen1910a	4	43
Metsä loistaa vaaleanpunaisena lammen takana.	644343	644388	lehtonen1910a	4	45
Metsä räikkyy ja ruskaa.	383817	383841	lehtonen1910a	3	24
Metsäkanako se oli?	172129	172148	lehtonen1910a	2	19
Metsässä ovat olleet lekkerit.	411597	411627	lehtonen1910a	3	30
Metsästys.	94202	94212	jarnefelt1913a	0	10
Metso ei ole hänestä millänsäkään.	175986	176020	lehtonen1910a	4	34
Mi-mikä se on Jopilla peli?	82573	82600	lehtonen1910a	4	27
Miehen atraimesta se ei karkaa.	691441	691472	lehtonen1910a	4	31
Miehen mielenkiinto on jaollista.	250403	250436	jarnefelt1916a	3	33
Miehet ja poika perästä.	106943	106967	lassila1910a	3	24
Miehet poistuvat.	90623	90640	jarnefelt1913a	1	17
Miehet saapuivat jo lähelle Hyvärisen tiehaaraa.	274461	274509	lassila1910a	5	48
Miehet vaikenivat.	141308	141326	lassila1910a	1	18
Mieleisiä nämä Käkriäiset ovat minulle.	786310	786349	lehtonen1910a	4	39
Mielenkarvaus sen vaikutti.	132496	132523	lassila1910a	2	27
Mieletön mettiäinen, mitä teet sinä?	41109	41145	jarnefelt1913a	4	36
Mieli oli kotia päin lähtiessä painunut.	17667	17707	pakkala1895a	5	40
Mieli teki kiertää koko talo.	275663	275692	lassila1910a	4	29
Mielikuvitus oli aivan irrallaan.	34344	34377	pakkala1895a	3	33
Mielisuosiolla hänet saa mihin tahansa.	503028	503067	lehtonen1910a	4	39
Mieluummin minä menen laivaan.	623252	623282	lehtonen1910a	3	30
Mies alkoi jo kertoa omia salaisuuksiansa.	51841	51883	lassila1910a	5	42
Mies kuivaili lakitta päin ohimoitaan.	13228	13266	jarnefelt1916a	4	38
Mies makasi seinän puolella ja kuorsnasi.	1369	1410	canth1886a	5	41
Mies nauraa ja myönnyttelee.	257737	257765	jarnefelt1916a	3	28
Mies oli kuollut.	322747	322764	lehtonen1910a	2	17
Mies tuli kivulloiseksi, työhön kykenemättömäksi.	296963	297012	lehtonen1910a	4	49
Mies, näettekö, rakastaa sporttia.	112157	112191	canth1886a	3	34
Mieskin oli hereillä taas.	2246	2272	canth1886a	3	26
Miettiviksi kävivät miehet.	129734	129761	lassila1910a	2	27
Mihin hän ne nyt panee?	33531	33554	pakkala1895a	4	23
Mihinkäpä sudet vanhoina joutuvat?	324166	324200	lehtonen1910a	3	34
Mihinkäs ne?	692918	692930	lehtonen1910a	1	12
Mihinkäs tässä muuten jouduttaisiin?	54204	54240	lehtonen1910a	3	36
Miina teki niin.	233715	233731	canth1886a	2	16
Miina toi hänelle kirjelapun.	194854	194883	canth1886a	3	29
Miina tuli pyytämään häntä sisään.	151948	151982	canth1886a	4	34
Miina tuli sisään.	212743	212761	canth1886a	2	18
Miitä tämä on?	108123	108137	jarnefelt1913a	2	14
Miitä tämä on?	108468	108482	jarnefelt1913a	2	14
Miitä, miitä?	115248	115261	jarnefelt1913a	1	13
Miitä?	108116	108122	jarnefelt1913a	0	6
Mikä Kallen perii?	85662	85680	pakkala1895a	2	18
Mikä noiden onnettomain osaksi tulisi elämässä?	12024	12071	canth1886a	5	47
Mikä on mielessäsi?	92439	92458	jarnefelt1913a	2	19
Mikä onkaan mielessäsi?	124272	124295	jarnefelt1913a	2	23
Mikä panikin Juutaksen Muttista panettelemaan.	501729	501775	lehtonen1910a	4	46
Mikä siinä on sellainen: Yyyy-yy?	82518	82551	lehtonen1910a	4	33
Mikä sinulle siellä riihellä tuli?	499827	499861	lehtonen1910a	4	34
Mikä sinun on?	115309	115323	jarnefelt1913a	2	14
Mikä tulisi heille eteen.	29933	29958	canth1886a	3	25
Mikä vihertävä läiskä tuolla peränurkassa?	658129	658171	lehtonen1910a	4	42
Mikään ei ollut auttanut.	17998	18023	jarnefelt1916a	3	25
Mikään ei voi olla minulle yllätys.	92679	92714	jarnefelt1913a	5	35
Mikähän sen olisi pudottanut?	68098	68127	lehtonen1910a	3	29
Mikäs sitä kesäistä madetta ottamaan.	192303	192340	lehtonen1910a	4	37
Miks'ei ihminen aina sointuna keinu?	20610	20646	kilpi1903a	4	36
Miksi ajaa rikkauksia?	765801	765823	lehtonen1910a	2	22
Miksi ei Ananiaskin sellainen olisi?	472671	472707	lehtonen1910a	4	36
Miksi ei hän tullut veneellä?	380621	380650	lehtonen1910a	4	29
Miksi ei Kalle ollutkaan eksynyt?	86612	86645	pakkala1895a	4	33
Miksi ei olisi jättänyt?	321597	321621	lehtonen1910a	3	24
Miksi ei saa olla kotona?	116385	116410	pakkala1895a	4	25
Miksi ei vienyt heti takaisin kaikkia?	33409	33447	pakkala1895a	5	38
Miksi eivät ihmiset elä keskenään rauhassa?	112597	112640	lehtonen1910a	5	43
Miksi hän ei ole lampea laskenut?	478139	478172	lehtonen1910a	5	33
Miksi häntä vainotaan, aina?	505611	505639	lehtonen1910a	3	28
Miksi ihminen ei voi vapautua kuolemankammosta?	72894	72941	jarnefelt1913a	5	47
Miksi Luoja ei salli?	464563	464584	lehtonen1910a	3	21
Miksi ne ajoivat?	55568	55585	lehtonen1910a	2	17
Miksi ne kuolivat?	773475	773493	lehtonen1910a	2	18
Miksi ottikin niin paljon?	33382	33408	pakkala1895a	3	26
Miksi ponnistaisi henkeänsä selkeäksi ja kirkkaaksi?	75555	75607	kilpi1903a	5	52
Miksi säihkyisi tahtovaksi toivovaksi rohkeudeksi?	75608	75658	kilpi1903a	4	50
Miksi sairastuu äiti juuri Martin poissaollessa?	218165	218213	jarnefelt1916a	5	48
Miksi se sinne kärkeen, yksinäiseen paikkaan?	509462	509507	lehtonen1910a	5	45
Miksi sen tein?	767974	767989	lehtonen1910a	2	15
Miksi sitä Ripattiakin pidetään täällä?	340713	340752	lehtonen1910a	4	39
Miksi vaihtelee ihmisen olo niin?	102084	102117	kilpi1903a	4	33
Miksi vaivautuisi tahtomaan ja toivomaan?	75513	75554	kilpi1903a	4	41
Miksikä ei Jumala Kallea rangaissut?	86646	86682	pakkala1895a	4	36
Miksikä tulikin sieltä?	77436	77459	pakkala1895a	2	23
Milläs neuvoilla Rosina on tullut kotiin?	413036	413077	lehtonen1910a	5	41
Milloin hihkaisten leukapielet taivasta kohti levällään.	84966	85022	lehtonen1910a	5	56
Milloin suu pyöreänä ja möräkällä äänellä.	84923	84965	lehtonen1910a	5	42
Milloinkahan hän parantuu?	122282	122308	pakkala1895a	2	26
Minä _rakastan_ ruotsin kieltä.	281552	281583	jarnefelt1916a	3	31
Minä aivan itkin salatuista haukotuksista.	8154	8196	jarnefelt1913a	4	42
Minä aloin lähteä.	100634	100652	jarnefelt1916a	2	18
Minä annan tälle pitäjälle pitkät ruikulit.	296372	296415	lehtonen1910a	5	43
Minä en heitä suvaitse.	211613	211636	lehtonen1910a	3	23
Minä en sano mitään, ellei kysytä.	92051	92085	jarnefelt1913a	5	34
Minä en sanonut mitään.	106039	106062	jarnefelt1916a	3	23
Minä en syö pirujakaan.	151174	151197	lehtonen1910a	3	23
Minä en tehnyt kumpaakaan.	66561	66587	jarnefelt1913a	3	26
Minä en tiedä mitä tyyli onkaan.	1423	1455	jarnefelt1916a	5	32
Minä en voi kovistella Juutasta enää.	778866	778903	lehtonen1910a	5	37
Minä ensi anna uunipulfer Maarille.	117751	117786	jarnefelt1913a	4	35
Minä hämmästyin.	55059	55075	jarnefelt1916a	1	16
Minä katselemistani katselin häntä.	193305	193340	jarnefelt1916a	3	35
Minä kerroin kaiken.	24557	24577	jarnefelt1913a	2	20
Minä kun usutan kaikki kimppuusi.	492906	492939	lehtonen1910a	4	33
Minä nyt en vaan semmoisia usko.	214282	214314	canth1886a	5	32
Minä nyt en vaatteissa koreile.	488931	488962	lehtonen1910a	4	31
Minä olen enemmän kuin onnellinen.	54291	54325	jarnefelt1916a	4	34
Minä olen Kypenäisen Mauno.	493040	493067	lehtonen1910a	3	27
Minä olen maannut niissä ennenkin.	311668	311702	lehtonen1910a	4	34
Minä olen sellainen mies.	494856	494881	lehtonen1910a	3	25
Minä olin hyvän aikaa taas äimistyksissäni.	246896	246939	jarnefelt1916a	5	43
Minä olin päivän sankari.	54395	54420	jarnefelt1913a	3	25
Minä poltan.	386827	386839	lehtonen1910a	1	12
Minä pukeuduin.	220654	220669	jarnefelt1916a	1	15
Minä pysähdyn.	129853	129867	jarnefelt1913a	1	14
Minä rukoilen sinua _itseni_ vuoksi.	168772	168808	jarnefelt1916a	4	36
Minä sain kirjeen lukeakseni.	123451	123480	jarnefelt1916a	3	29
Minä sanoin jo nähneeni asianomaiset tulkittavat.	16639	16688	jarnefelt1916a	5	49
Minä sanoin uskovani.	89800	89821	jarnefelt1916a	2	21
Minä sanoin, kenen luona olin kotiopettajattarena.	55280	55330	jarnefelt1916a	5	50
Minä selitin, että ei.	75897	75919	jarnefelt1913a	3	22
Minä tahdon olla täällä aina.	764011	764040	lehtonen1910a	4	29
Minä tapoin.	111408	111420	jarnefelt1913a	1	12
Minä tiedän, mistä saa.	270159	270182	lehtonen1910a	3	23
Minä tunnen teidät niin hyvin, rakkaani.	32722	32762	jarnefelt1916a	5	40
Minä tunnen teidät.	150295	150314	jarnefelt1913a	2	19
Minä tunnustan.	110106	110121	jarnefelt1913a	1	15
Minä vaikenin.	44457	44471	jarnefelt1916a	1	14
Minä, hupsu, ostin pilkallani.	151100	151130	lehtonen1910a	3	30
Minähän olen sivistynyt muka.	779843	779872	lehtonen1910a	3	29
Minäkö en ymmärrä?	450556	450574	lehtonen1910a	2	18
Mine anna henel hjuvä, hjuvä paikka.	117202	117238	jarnefelt1913a	5	36
Mine ei voi kauemmi.	119462	119482	jarnefelt1913a	3	20
Mine kiitte Maria.	110374	110392	jarnefelt1913a	2	18
Mine ootta, da.	117186	117201	jarnefelt1913a	2	15
Mine teytty anmälä ett brottmål.	114429	114461	jarnefelt1913a	4	32
Minjä paaljo matkustanut.	107062	107087	jarnefelt1913a	2	25
Minkä minä kuolleella teen, ajattelin.	66787	66825	jarnefelt1913a	4	38
Minkä vuoksi hänen pitää täällä olla?	116347	116384	pakkala1895a	5	37
Minkähänlaisia nuo muurit ovat?	128078	128109	lehtonen1910a	3	31
Minkäpä tekee Juutas?	99707	99728	lehtonen1910a	2	21
Minkäs hänelle nyt enää mahtoi?	508296	508327	lehtonen1910a	4	31
Minkätähden ei elättää anneta?	505824	505854	lehtonen1910a	3	30
Minkätähden pitää ihmisten olla sellaisia?	97722	97764	lehtonen1910a	4	42
Minne hän aikoo?	500914	500930	lehtonen1910a	2	16
Minne hän lähtisi, hypähdettyään jaloilleen?	472308	472352	lehtonen1910a	4	44
Minne Juutas menee?	110463	110482	lehtonen1910a	2	19
Minne lie nyt mennyt, raukka?	520564	520593	lehtonen1910a	4	29
Minne lienee päässyt.	396460	396481	lehtonen1910a	2	21
Minne Luoja sallii pirujen viedä.	324765	324798	lehtonen1910a	4	33
Minnekä hän lähtee?	106393	106412	lehtonen1910a	2	19
Minnekä Saara menee, mitä, Sanukka?	160581	160616	lehtonen1910a	4	35
Minnekähän se lienee mennyt?	197741	197769	lehtonen1910a	3	28
Minnekähän se menee?	60505	60525	pakkala1895a	2	20
Minnekäpä Ananias sitten menee?	230037	230068	lehtonen1910a	3	31
Minnekäs se nyt ennätti lentää?	204316	204347	lehtonen1910a	4	31
Minnekäs se?	155261	155273	lehtonen1910a	1	12
Minua suututtaa, että se otettiinkin tänne?	591630	591673	lehtonen1910a	5	43
Minua suututtaa.	233942	233958	lehtonen1910a	1	16
Minulla ei ole mitään edellytyksiä sellaiseen.	7327	7373	jarnefelt1916a	5	46
Minulla kun on muitakin hyyryläisiä.	80559	80595	canth1886a	4	36
Minulla on kaikki selvillä.	485380	485407	lehtonen1910a	3	27
Minulla on kolme sikaa.	203044	203067	lehtonen1910a	3	23
Minun elefanttini?	590324	590342	lehtonen1910a	1	18
Minun kultainen munani?	590343	590366	lehtonen1910a	2	23
Minun olisi pitänyt se arvata.	157221	157251	jarnefelt1916a	4	30
Minun pieni elefanttini?	578055	578079	lehtonen1910a	2	24
Minun pitää näet silloin myös hymyillä.	4011	4050	jarnefelt1913a	5	39
Minun täytyi luvata.	98954	98974	jarnefelt1916a	2	20
Minunkin pitää maailmassa elää.	494824	494855	lehtonen1910a	3	31
Minunkin sydämeni alkoi suorastaan ilosta hyppiä.	253276	253325	jarnefelt1916a	5	49
Minunko äitini?	156052	156067	jarnefelt1913a	1	15
Minusta ei ole siihen.	772090	772112	lehtonen1910a	3	22
Missä aaltoisi ihmisen sielu unohtuneimpana uneksuntana?	46962	47018	kilpi1903a	5	56
Missä Antón Antónovitsh?	105498	105522	jarnefelt1913a	2	24
Missä hän on?	730042	730055	lehtonen1910a	2	13
Missä lienee Juutas?	421708	421728	lehtonen1910a	2	20
Missä lienee ollut.	51201	51220	lehtonen1910a	2	19
Missä lieneekin ollut Hurja juoksemassa.	68734	68774	lehtonen1910a	4	40
Missä ne ovat kaikki?	420675	420696	lehtonen1910a	3	21
Missä on Ananiaksen selkäsaunaa paennut Topi?	165010	165055	lehtonen1910a	5	45
Missä on siis oikeudenmukaisuus?	220100	220132	jarnefelt1916a	3	32
Missä saisi ihminen ihanimpana raueta?	46923	46961	kilpi1903a	4	38
Missä se kaupunki nyt lienee?	260330	260359	lehtonen1910a	4	29
Missä se nyt taas kutvehtii?	73439	73467	lehtonen1910a	4	28
Missä se on Leja?	511824	511841	lehtonen1910a	3	17
Missä se on?	159777	159789	lehtonen1910a	2	12
Missä se perhanan akka on?	277448	277474	lehtonen1910a	4	26
Missä se Sanelma lienee?	471754	471778	lehtonen1910a	3	24
Missä sinä asut?	55262	55278	jarnefelt1916a	2	16
Missä sinä olet ollut?	217107	217129	lehtonen1910a	3	22
Missä?	255875	255881	lehtonen1910a	0	6
Missä?	473445	473451	lehtonen1910a	0	6
Missä?	4904	4910	jarnefelt1913a	0	6
Missähän se kaupunki sitten on?	253530	253561	lehtonen1910a	4	31
Missähän se nyt lienee?	595465	595488	lehtonen1910a	3	23
Missäs Jopi ja Topi ovat?	554573	554598	lehtonen1910a	4	25
Missäs se meidän Sanelma on?	570061	570089	lehtonen1910a	4	28
Mistä ja minkä vuoksi?	173341	173363	jarnefelt1916a	3	22
Mistä rangaistusta?	218423	218442	jarnefelt1916a	1	19
Mistä se siihen yhtäkkiä lensi?	434543	434574	lehtonen1910a	4	31
Mistä syystä tapoin?	65138	65158	jarnefelt1913a	2	20
Mistä syystä?	60683	60696	lehtonen1910a	1	13
Mistäpä olisi kansalle parempaa esimerkkiä?	781733	781776	lehtonen1910a	4	43
Mitä aikonee?	548666	548679	lehtonen1910a	1	13
Mitä haet sinä?	40927	40942	jarnefelt1913a	2	15
Mitä hänellä on Esterissä auttamista?	544764	544801	lehtonen1910a	4	37
Mitä he siitä arvelisivat?	33435	33461	canth1886a	3	26
Mitä ihmeitä hän noin tuimasti ajattelee?	288683	288724	jarnefelt1916a	5	41
Mitä ihmeitä tämä on?	257148	257169	jarnefelt1916a	3	21
Mitä ihmettä hän sillä lienee tarkoittanut?	161003	161046	jarnefelt1916a	5	43
Mitä isket silmääsi, Rosinukka?	311058	311089	lehtonen1910a	3	31
Mitä Jumala niillä tekee?	83638	83663	pakkala1895a	3	25
Mitä kummaa?	58045	58057	lehtonen1910a	1	12
Mitä lienee opettaja tarkoittanut?	719030	719064	lehtonen1910a	3	34
Mitä lienevät rohtoja.	518051	518073	lehtonen1910a	2	22
Mitä minä siis surin?	27509	27530	jarnefelt1913a	3	21
Mitä mukavia?	531466	531479	lehtonen1910a	1	13
Mitä ne ihmiset sellaisesta ihmettelevät?	321721	321762	lehtonen1910a	4	41
Mitä niitä siihen jättää?	87523	87548	pakkala1895a	3	25
Mitä nyt?	123262	123271	jarnefelt1913a	1	9
Mitä odotti maailma minulta?	29656	29684	jarnefelt1913a	3	28
Mitä oli hän tehnyt?	131340	131360	canth1886a	3	20
Mitä oli sisaren lahjat tämän suhteen?	472	510	pakkala1895a	5	38
Mitä on elämä?	13485	13499	kilpi1903a	2	14
Mitä on kauniina oleminen?	33962	33988	kilpi1903a	3	26
Mitä on siis kauniina oleminen?	35736	35767	kilpi1903a	4	31
Mitä ovat maailman makeudet?	766164	766192	lehtonen1910a	3	28
Mitä sanoin minä siis sinulle?	145235	145265	jarnefelt1913a	4	30
Mitä se Hurja haukkuu?	405285	405307	lehtonen1910a	3	22
Mitä se Juutas siellä pihalla?	388194	388224	lehtonen1910a	4	30
Mitä se nyt niistä tiedustelee?	275224	275255	lehtonen1910a	4	31
Mitä se Saara sanoi?	140710	140730	lehtonen1910a	3	20
Mitä se siellä tekee?	248380	248401	lehtonen1910a	3	21
Mitä se taas täällä?	778583	778603	lehtonen1910a	3	20
Mitä se tuollainen on?	311954	311976	lehtonen1910a	3	22
Mitä siihen sanotte?	7782	7802	jarnefelt1913a	2	20
Mitä siis Martti oikeastaan oli?	175384	175416	jarnefelt1916a	4	32
Mitä sinä kirjoitit?	763725	763745	lehtonen1910a	2	20
Mitä sinä sanoitkaan minulle?	158150	158179	jarnefelt1913a	3	29
Mitä suloutta on väkisin annetulla ystävyydellä?	776649	776697	lehtonen1910a	5	48
Mitä tämä on?	93044	93057	jarnefelt1916a	2	13
Mitä tämä on?	259189	259202	jarnefelt1916a	2	13
Mitä tämä on?	259203	259216	jarnefelt1916a	2	13
Mitä tekisi?	75430	75442	kilpi1903a	1	12
Mitä varten hän oli yrittänytkään.	25965	25999	canth1886a	4	34
Mitä varten?	170447	170459	canth1886a	1	12
Mitä ystävällisin vastaanotto.	216632	216662	jarnefelt1916a	2	30
Mitä, Sanukka?	459394	459408	lehtonen1910a	1	14
Mitään vaikutusta puheillani ei ollut.	205822	205860	jarnefelt1916a	4	38
Mitähän ne ovat tehneet sillä aikaa?	121933	121969	pakkala1895a	5	36
Mitähän ne sanovat?	550308	550327	lehtonen1910a	2	19
Mitähän ne taas siellä mekastavat?	341903	341937	lehtonen1910a	4	34
Mitähän ne vieraat ovat?	405736	405760	lehtonen1910a	3	24
Mitähän ne viirut ovat?	175339	175362	lehtonen1910a	3	23
Mitähän niissä olisi?	553185	553206	lehtonen1910a	2	21
Mitähän nyt tullee.	548680	548699	lehtonen1910a	2	19
Mitähän se tarkoitti?	375558	375579	lehtonen1910a	2	21
Mitähän tytöt sanovat, kun hän parantuu?	128777	128817	pakkala1895a	5	40
Mitäpä hänellä oli sanottavaa?	69786	69816	canth1886a	3	30
Mitäpä rahaa Saaralla olisi?	250295	250323	lehtonen1910a	3	28
Mitäs ne lapset siellä?	201714	201737	lehtonen1910a	3	23
Mitäs se Juutas sanoi tässä Moksista?	387654	387691	lehtonen1910a	5	37
Mitäs sinä siinä ratustelet?	199672	199700	lehtonen1910a	3	28
Mitäs tämä on?	553404	553418	lehtonen1910a	2	14
Mitäs, jos Muttinen kuolisi perunamyrkytykseen?	600696	600743	lehtonen1910a	4	47
Mitäs, Mauno, jospa me autetaan Rosinukkaa?	522347	522390	lehtonen1910a	5	43
Miten hän tullee siellä toimeen.	214125	214157	canth1886a	4	32
Miten hemmetissä saisin hänet sitä rakastamaan?	779045	779092	lehtonen1910a	5	47
Miten ruskea sinä olet, sinä ruskeasilmä.	552766	552807	lehtonen1910a	5	41
Miten se oli selitettävissä?	86914	86942	jarnefelt1916a	3	28
Mitenkä tässä on ennättänyt sitä keitellä?	101202	101244	lehtonen1910a	5	42
Mitkä ovat oikeastaan vaatimuksenne miehiin nähden?	228874	228925	jarnefelt1916a	5	51
Mitkä?	722358	722364	lehtonen1910a	0	6
Moisesta Jussi yltyi silmittömäksi.	70612	70647	lassila1910a	3	35
Mökeissä ja taloissa.	52037	52058	lehtonen1910a	2	21
Mökiltä ei muita teitä kuin vesi.	782211	782244	lehtonen1910a	5	33
Mökin pihalla ei vielä liiku ketään.	12837	12873	lehtonen1910a	5	36
Mökin pihalla näyttää seisovan pari miestä.	536265	536308	lehtonen1910a	5	43
Mökin pihalla on aivan hiljaista.	465667	465700	lehtonen1910a	4	33
Mökin pihalla on hiljaista.	10957	10984	lehtonen1910a	3	27
Mökin savupiipusta leijailee sauhua.	613006	613042	lehtonen1910a	3	36
Mökkiläiset kerääntyvät ympärille.	375012	375046	lehtonen1910a	2	34
Mökkiläisiä possakassa.	338861	338884	lehtonen1910a	1	23
Mokomat parjaajat.	198011	198029	canth1886a	1	18
Moksi ponnistelee vastaan, naukaisee ja raapii.	640585	640632	lehtonen1910a	5	47
Moksia Repekka nyt vanuttaisi.	71645	71675	lehtonen1910a	3	30
Molemmat miettivät yhä asiaa.	20282	20311	lassila1910a	3	29
Molemmat olivat äänettöminä.	120749	120777	canth1886a	2	28
Molemmat palvelijat painoivat häntä takaisin vuoteelle.	234783	234838	canth1886a	5	55
Molemmat puhuivat ikäänkuin itseksensä.	149135	149174	lassila1910a	3	39
Molemmat samassa.	727726	727743	lehtonen1910a	1	17
Molemmat taas emme voi matkustaa.	207495	207528	jarnefelt1916a	4	33
Molemmin puolin ovea riippui päällysvaatteita seinällä.	24146	24201	canth1886a	5	55
Monesti ei Rosina käykään kaupungissa.	190122	190160	lehtonen1910a	4	38
Monta kertaa sain hihallani kuivata kasvoja.	273360	273404	jarnefelt1916a	5	44
Moottori kääntyi toisen niemen ympäri.	533692	533730	lehtonen1910a	4	38
Morsiamista kuullessaan Malakias punastuu vihasta.	170593	170643	lehtonen1910a	4	50
Morsian sitten.	201234	201249	canth1886a	1	15
Muista ikkunoista ei se vielä paistakaan.	117821	117862	lehtonen1910a	5	41
Muista se.	217410	217420	lehtonen1910a	1	10
Muista.	100485	100492	jarnefelt1913a	0	7
Muistaa se vaadittaa työhön.	367937	367965	lehtonen1910a	3	28
Muistakin asioista se oli nälkyttänyt.	27334	27372	lehtonen1910a	4	38
Muistan Jöijeäni hänen viidenneltä ikävuodeltaan asti.	49357	49411	jarnefelt1916a	5	54
Muistan.	349800	349808	lehtonen1910a	0	8
Muistotkin täällä minua siihen kehottavat.	766637	766679	lehtonen1910a	4	42
Muitakin ehtoja oli vielä.	28510	28536	lehtonen1910a	3	26
Muka vieraisilla, miestään kuljettaen.	245543	245581	lehtonen1910a	3	38
Mukavuuteen tottuneen.	697119	697141	lehtonen1910a	1	22
Multaa turpa täyteen.	506539	506560	lehtonen1910a	2	21
Mummo kulkee lämpöistä kujaa edelleen.	319620	319658	lehtonen1910a	4	38
Mummo menee läheltä kurkistamaan.	201251	201284	lehtonen1910a	3	33
Mummo on tuonut risuja kahvipuiksi.	327946	327981	lehtonen1910a	4	35
Mummo selittää, että eikö liene saanut.	426050	426089	lehtonen1910a	5	39
Mummo siunailee veräjällä.	80661	80687	lehtonen1910a	2	26
Mummo siunailee.	437701	437717	lehtonen1910a	1	16
Mummo tähystelee vielä pihalle päin.	688185	688221	lehtonen1910a	4	36
Mummo tuutii Luukasta.	422642	422664	lehtonen1910a	2	22
Mummo voihkii tätä poloista elämää.	516799	516834	lehtonen1910a	4	35
Mummon sanat muuttuvatkin kiitolliseksi ihmettelyksi.	433971	434024	lehtonen1910a	4	53
Musiikki soi.	189146	189159	canth1886a	1	13
Musta pimeys ammotti heille vastaan.	89070	89106	canth1886a	4	36
Musta sametti korottaa teidän hiviönne hohdetta.	197219	197267	canth1886a	5	48
Mut asia tule oikköyden etten.	110153	110183	jarnefelt1913a	4	30
Mut ei yhtaikka, rakas pikku.	95472	95501	jarnefelt1913a	4	29
Mut miitä tämä on?	108449	108467	jarnefelt1913a	3	18
Muta ei se ole niin.	203664	203684	jarnefelt1916a	4	20
Mutisi niiden olevan suuria.	73860	73888	lehtonen1910a	3	28
Mutta Aappo ei välittänyt enää.	68663	68694	pakkala1895a	4	31
Mutta äärettömän hauskaa se vaan oli.	67233	67270	jarnefelt1916a	5	37
Mutta äiti ei herännyt.	32911	32934	canth1886a	3	23
Mutta äiti ei siihen suostunut.	72059	72090	pakkala1895a	4	31
Mutta äiti heitä torui.	7324	7347	canth1886a	3	23
Mutta ajatukset menivät väkistenkin aina siihen.	126737	126785	canth1886a	5	48
Mutta älähän nyt hätäile.	789018	789043	lehtonen1910a	3	25
Mutta alkaminen on aina niin vaikea.	503475	503511	lehtonen1910a	5	36
Mutta Alma vielä pidätti.	123250	123275	canth1886a	3	25
Mutta Almalle tuli toinen tuska.	223940	223972	canth1886a	4	32
Mutta Alman silmät olivat auki yhä.	231746	231781	canth1886a	5	35
Mutta Ananiakselle tarjoaa Muttinen paperossin.	555601	555648	lehtonen1910a	4	47
Mutta Ananiasta ei näy.	384776	384799	lehtonen1910a	3	23
Mutta Anna Liisa oli vielä epätietoinen.	258443	258483	lassila1910a	5	40
Mutta antaisimme sen heille mielellämme anteeksi.	787481	787530	lehtonen1910a	5	49
Mutta Antti koetti vielä onneansa.	22204	22238	lassila1910a	4	34
Mutta Antti kokoilikin vain voimiansa.	31757	31795	lassila1910a	4	38
Mutta Antti osottautuikin oikeaksi puhemieheksi.	128301	128349	lassila1910a	4	48
Mutta asia ei ollutkaan unohtunut.	9737	9771	lassila1910a	4	34
Mutta ei hän siitä välittänyt.	330596	330626	lehtonen1910a	4	30
Mutta ei hän unta saanut.	132968	132993	canth1886a	4	25
Mutta ei häntä kukaan katsokaan.	286978	287010	lehtonen1910a	4	32
Mutta ei ihan ikkunan alla paskimassa.	389733	389771	lehtonen1910a	5	38
Mutta ei kukaan ollut nauranut.	27485	27516	pakkala1895a	4	31
Mutta ei kuulu hiljaistakaan lehmien ammumista.	46116	46163	lehtonen1910a	5	47
Mutta ei se äiti Jopille valehtele.	130305	130340	lehtonen1910a	5	35
Mutta ei se sen virkeämmäksi tullut.	75805	75841	lehtonen1910a	5	36
Mutta ei siinä kaikki.	191277	191299	jarnefelt1916a	3	22
Mutta ei siinä kyllin.	150933	150955	jarnefelt1916a	3	22
Mutta ei sitä mies voi peräytyä.	503396	503428	lehtonen1910a	5	32
Mutta ei tuli syttynyt vielä.	78148	78177	lassila1910a	4	29
Mutta ei.	254881	254890	jarnefelt1916a	1	9
Mutta eihän hän kiireiltään aina joutanut.	54083	54125	pakkala1895a	5	42
Mutta eihän John sitä kuullut.	131501	131531	canth1886a	4	30
Mutta eihän Partanen voinut sitä tietää.	214832	214872	lassila1910a	5	40
Mutta eihän Rosina häntä tarkoittanut, vierasta.	518693	518741	lehtonen1910a	5	48
Mutta eihän se nyt enää.	749512	749536	lehtonen1910a	4	24
Mutta eihän siellä ollutkaan mitään.	674877	674913	lehtonen1910a	4	36
Mutta eihän tuota nyt ruostetta tarvitakaan.	568157	568201	lehtonen1910a	5	44
Mutta eikö hän aio saunaan?	733187	733214	lehtonen1910a	4	27
Mutta eikö saa olla minun hilloani?	107454	107489	jarnefelt1913a	5	35
